,text,dataset,aspect_str,aspects
140,has O 4x O optical B-aspect zoom I-aspect which O is O higher O than O any O other O in O the O same O price O range O . O,Canon G3.txt,optical zoom[+1],['optical zoom']
141,it O is O generally O overpriced O a O little O bit O but O you O get O what O you O are O paying O for O . O,Canon G3.txt,,[]
142,"maybe O it O is O my O lack O of O experience O , O but O i O found O shots O with O this O camera O very O disappointing O . O",Canon G3.txt,picture[-3][u],['picture']
143,it O was O i O sold O it O after O a O few O months O too O expensive O for O the O shots O that O i O got O . O,Canon G3.txt,price[-3][u],['price']
144,"sure O it O had O all O the O features O , O but O when O i O tried O to O shoot O a O girl O 's O basketball O game O it O just O wa O n't O up O to O the O task O . O",Canon G3.txt,camera[-2][u],['camera']
145,i O do O n't O think O i O was O asking O too O much O . O,Canon G3.txt,,[]
146,any O film O zoom O p O and O s O would O have O given O superior O results O with O a O minimal O effort O . O,Canon G3.txt,,[]
147,and O with O the O 500 O you O save O you O could O print O the O results O for O the O life O of O the O camera O . O,Canon G3.txt,,[]
148,i O found O that O low O light O situations O combined O with O any O sort O of O action O left O this O camera B-aspect in O the O dust O . O,Canon G3.txt,camera[-3],['camera']
149,i O wanted O it O to O shoot O concerts O as O well O . O,Canon G3.txt,,[]
150,that O meant O even O less O light O and O just O as O much O action O . O,Canon G3.txt,,[]
151,"sure O , O i O adjusted O the O film O speed O to O 400 O . O",Canon G3.txt,,[]
152,the O grain B-aspect was O terrible O . O,Canon G3.txt,grain[-3],['grain']
153,next O time O i O set O it O at O 100 O and O used O the O flash O . O,Canon G3.txt,,[]
154,"well O flash O photos O are O never O great O , O and O there O was O still O a O lot O of O noise B-aspect . O",Canon G3.txt,"flash photo[-3],noise[-2]","['flash photo', 'noise']"
155,"when O i O took O outdoor O photos O with O plenty O of O light O and O the O objects O were O n't O moving O , O the O photos O were O awesome O . O",Canon G3.txt,photo[+3],['photo']
156,the O camera B-aspect was O a O marvel O . O,Canon G3.txt,camera[+1],['camera']
157,getting O the O printer O to O help O output O them O was O another O tale O . O,Canon G3.txt,,[]
158,overall O i O think O that O you O need O to O consider O what O you O wa O n't O to O do O . O,Canon G3.txt,,[]
159,"for O simple O point O and O shoot O photography O , O consider O a O cheaper O digital O . O",Canon G3.txt,,[]
160,you O do O n't O need O the O extra O resolution O or O the O cost O . O,Canon G3.txt,,[]
161,then O again O a O one O time O use O camera O may O do O just O as O well O . O,Canon G3.txt,,[]
162,"if O you O shoot O in O lots O of O light O and O desire O high O quality O , O this O will O be O your O camera O . O",Canon G3.txt,,[]
163,it O is O versatile O and O seems O to O be O one O of O the O best O . O,Canon G3.txt,camera[+3][p],['camera']
164,"me O , O i O am O going O with O a O leica O minilux O the O g3 O was O replacing O mine O which O was O stolen O . O",Canon G3.txt,,[]
165,"it O is O less O versatile O , O but O i O am O never O disappointed O with O the O output O . O",Canon G3.txt,,[]
166,"i O am O a O long-time O user O of O highly O responsive O film O slrs O and O professional O quality O external O flash O equipment O , O just O so O you O know O my O bias O . O",Canon G3.txt,,[]
167,"i O have O been O watching O the O development O of O digicams O for O years O , O waiting O to O make O my O first O move O . O",Canon G3.txt,,[]
168,"what O i O really O want O is O a O $ O 1,500 O digital O slr O with O a O full O frame O sensor O that O will O take O my O nikon O lenses O . O",Canon G3.txt,,[]
169,"i O figure O that O is O at O least O three O years O off O , O and O i O am O getting O impatient O . O",Canon G3.txt,,[]
170,hence O i O decided O to O spring O for O a O point-and-shoot O digicam O that O that O would O have O features O that O would O let O me O get O around O their O inherent O limitations O . O,Canon G3.txt,,[]
171,"i O chose O the O g3 B-aspect because O of O its O reputation O for O very O high O quality O , O clean O images O . O",Canon G3.txt,g3[+1],['g3']
172,"the O two O limitations O i O knew O i O would O have O to O deal O with O are O the O very O long O lag B-aspect time I-aspect before O it O focus-locks O even O in O bright O light O , O and O the O unsatisfactory O light O quality O of O the O built-in O flash B-aspect . O",Canon G3.txt,"lag time[-2],flash[-2]","['lag time', 'flash']"
173,"as O of O this O writing O , O technology O has O not O solved O the O focus-lock O lag O time O problem O for O point-and-shoot O digicams O and O anyone O who O is O satisfied O with O it O simply O has O never O used O a O modern O film O slr O . O",Canon G3.txt,,[]
174,"at O least O once O youve O got O focus O lock O , O the O shutter O release O lag O time O for O the O g3 O is O about O 1/10 O of O a O second O , O which O from O what O ive O read O , O is O better O than O just O about O anything O else O available O . O",Canon G3.txt,,[]
175,what O makes O the O focus-lock O lag O time O something O i O can O live O with O is O the O extreme O depth B-aspect of O field O obtainable O with O these O point O and O shoot O digicams O at O f8 O . O,Canon G3.txt,depth[+1],['depth']
176,"once O i O get O focus O lock O , O i O can O then O wait O until O my O restless O subject O a O pet O or O a O child O strikes O an O amusing O pose O and O then O fire O the O shutter O with O some O reasonable O probability O of O getting O my O subject O still O in O focus O . O",Canon G3.txt,,[]
177,now O what O about O the O flash O problem O ? O,Canon G3.txt,,[]
178,"relative O to O what O i O can O easily O achieve O with O external O flash B-aspect on O my O nikon O slr O , O the O internal O flash B-aspect on O the O g3 O produces O harsh O , O flat O images O with O ugly O hot O spots O . O",Canon G3.txt,flash[-2],['flash']
179,"fortunately O , O the O g3 O has O a O hot O shoe O that O can O take O an O external O flash O , O and O fortunately O for O me O , O i O already O owned O a O one O of O the O highest O quality O external O flashes O that O money O can O buy O : O the O metz O 60 O ct-4 O . O",Canon G3.txt,external flash hot shoe[+1],['external flash hot shoe']
180,"i O cant O use O my O nikon O external O flash O on O a O canon O camera O , O but O i O can O use O my O metz O , O with O the O proper O metz O module O and O extension O cord O connected O between O the O g3 O and O the O 60 O ct-4 O . O",Canon G3.txt,,[]
181,"for O those O who O have O this O metz O flash O or O the O 45cl-3 O and O would O like O to O get O the O absolute O ultimate O quality O out O of O this O g3 O , O the O metz O module O you O need O is O the O sca O 3102 O and O the O connector O cord O is O the O sca O 3000c O . O",Canon G3.txt,,[]
182,"in O order O for O this O to O work O , O you O have O to O set O the O camera O to O manual O mode O and O set O the O shutter O speed O and O f-stop O yourself O . O",Canon G3.txt,,[]
183,"contrary O to O what O ive O read O elsewhere O , O the O g3 O does O sync O at O 1/250 O of O a O second O with O third-party O flashes O , O just O as O it O does O with O the O dedicated O flashes O from O canon O . O",Canon G3.txt,flash[+2],['flash']
184,"you O also O have O to O set O the O g3 O to O second O shutter O sync O , O which O is O what O youd O want O to O do O most O of O the O time O anyhow O . O",Canon G3.txt,,[]
185,"then O just O forget O about O all O the O controls O you O have O on O the O metz O flash O head O itself O and O the O sca O 3102 O control O panel O , O because O they O are O all O ignored O . O",Canon G3.txt,,[]
186,"the O g3 O completely O takes O over O controlling O the O duration O of O the O metz O flash O , O and O most O of O the O time O , O the O exposure O is O spot O on O and O when O it O isnt O , O its O because O youve O exceeded O the O range O of O the O metz O flash O itself O . O",Canon G3.txt,,[]
187,"this O might O happen O if O you O get O too O close O to O the O subject O and O you O are O not O bounce-flashing O , O or O if O you O are O bounce O flashing O and O the O walls O are O simply O too O far O away O . O",Canon G3.txt,,[]
188,"unfortunately O , O the O neutral O density O filters O for O the O metz O flash O are O no O longer O available O , O so O the O first O problem O cant O easily O be O solved O . O",Canon G3.txt,,[]
189,the O second O problem O is O solved O by O more O direct O lighting O from O the O metz O with O the O attendant O shadows O unfortunately O . O,Canon G3.txt,,[]
190,"but O once O youve O got O your O exposure O within O an O acceptable O range O , O the O g3 O is O shown O to O produce O utterly O stunning O images O that O i O can O hardly O get O with O my O nikon O f100 O film O camera O . O",Canon G3.txt,,[]
191,"the O 60 O ct-4 O flash O head O can O actually O be O reversed O 180 O degrees O and O then O tilted O , O enabling O you O to O bounce O the O flash O off O the O walls O behind O you O . O",Canon G3.txt,,[]
192,the O results O are O shadow-free O images O that O look O as O if O theyve O been O exposed O with O the O gentlest O natural O light O you O could O imagine O . O,Canon G3.txt,,[]
193,"now O there O is O one O more O complaint O i O have O about O the O g3 O and O that O is O the O software B-aspect that O comes O with O it O for O processing O raw O images O i O only O shoot O in O raw O image O mode O and O the O first O thing O i O did O was O replace O the O 32 O mbyte O cf O with O a O 512 O mbyte O cf O , O which O gives O me O 130 O raw O images O , O as O opposed O to O 7 O ! O",Canon G3.txt,software[-2],['software']
194,"the O canon O software B-aspect for O raw O images O does O not O present O you O with O a O raw O image O at O all O , O but O the O raw O image O after O it O has O been O processed O by O all O the O image-affecting O settings O in O the O camera O . O",Canon G3.txt,software[-2],['software']
195,i O believe O this O is O enabled O by O a O second O file O that O comes O out O of O the O camera O that O stores O all O this O information O . O,Canon G3.txt,,[]
196,"maybe O if O you O delete O those O files O before O you O looked O at O them O with O the O software O , O youd O see O the O true O , O raw O image O that O the O camera O actually O produces O . O",Canon G3.txt,,[]
197,i O didnt O wait O to O experiment O . O,Canon G3.txt,,[]
198,"instead O , O i O bought O the O adobe O photoshop O camera O raw O plug-in O . O",Canon G3.txt,,[]
199,what O this O plug-in O reveals O is O the O truly O stunning O quality O of O the O raw O g3 B-aspect hardware O . O,Canon G3.txt,g3[+3],['g3']
200,"without O any O tweaking O at O all O , O if O the O exposure O is O accurate O , O the O colors O are O as O realistic O as O ive O ever O seen O produced O by O film O , O and O this O is O a O raw O image O ! O",Canon G3.txt,color[+3],['color']
201,the O adobe O camera O raw O plug-in O shows O once O again O that O hardware O is O miles O ahead O of O software B-aspect . O,Canon G3.txt,"g3[+3],software[-2]","['g3', 'software']"
202,what O the O g3 O raw O image O software B-aspect gives O you O is O a O fantasy O world O designed O to O please O the O uncritical O . O,Canon G3.txt,software[-2],['software']
203,"what O the O photoshop O plug-in O gives O you O is O reality O , O and O then O if O you O want O fantasy O , O you O can O use O photoshop O to O create O it O . O",Canon G3.txt,,[]
204,but O at O least O youre O starting O with O the O most O photorealistic O images O ive O ever O seen O from O a O camera O . O,Canon G3.txt,image[+3],['image']
205,"i O am O stunned O and O amazed O at O the O quality O of O the O raw O images O i O am O getting O from O this O g3 O in O conjunction O with O my O professional O flash O system O , O and O can O easily O put O up O with O the O cameras O limitations O , O because O ive O never O seen O anything O better O within O its O resolution O limits O . O",Canon G3.txt,raw image[+3],['raw image']
206,"i O 've O had O this O for O 3 O months O now O , O and O i O am O pleased O with O my O decision O . O",Canon G3.txt,camera[+2][p],['camera']
207,this O is O the O perfect O camera B-aspect for O a O photo O hobbiest O who O wants O to O have O easy O point O and O shoot O ability O as O well O . O,Canon G3.txt,camera[+3],['camera']
208,my O girlfriend O loved O using O this O camera O so O much O as O a O point O and O shoot O that O i O had O to O pry O it O out O of O her O hands O most O of O the O time O . O,Canon G3.txt,,[]
209,"battery B-aspect life I-aspect , O the O drawback O to O most O digital O cameras O , O to O quote O k. O reeves O . O",Canon G3.txt,battery life[+1],['battery life']
210,"manual O functionality O is O excellent O , O downloading O pictures O is O quick O and O a O breeze O , O and O the O quality O is O astounding O . O",Canon G3.txt,"manual function[+2],picture quality[+3]","['manual function', 'picture quality']"
211,"i O did O a O good O month O 's O worth O of O research O before O buying O this O over O other O similar O priced O digital O cameras O , O and O this O is O the O best O buy O for O the O buck O . O",Canon G3.txt,,[]
212,"not O perfect O yes O , O the O viewfinder B-aspect can O get O obstructed O in O instances.but O the O lcd B-aspect works O well O enough O in O those O instances O , O not O the O cheapest O 4.0 O mp O , O but O the O best O 4.0 O mp O . O",Canon G3.txt,"viewfinder[-1],lcd[+2],camera[+3]","['viewfinder', 'lcd', 'camera']"
213,"if O you O do O n't O believe O me O on O that O , O check O the O consumer O reports O review O as O well O as O the O many O digital O camera O review O sites O out O there O . O",Canon G3.txt,,[]
214,"or O save O time O and O just O do O it O , O you O wo O n't O regret O it O . O",Canon G3.txt,,[]
215,"after O reading O the O very O positive O review O of O this O camera O in O a O leading O consumer O magazine O , O i O decided O to O head O here O , O to O amazon O , O to O read O through O the O online O reviews O . O",Canon G3.txt,,[]
216,"the O objections O of O the O naysayers O almost O caused O me O to O purchase O a O different O camera O , O but O , O in O the O end O , O i O figured O i O 'd O give O the O g3 O a O try O . O",Canon G3.txt,,[]
217,i O 'm O very O glad O i O did O . O,Canon G3.txt,,[]
218,the O service B-aspect from O the O supplier O was O exceptional O . O,Canon G3.txt,service[+3],['service']
219,the O camera O arrived O on O time O and O in O perfect O condition O . O,Canon G3.txt,,[]
220,"having O used O it O for O more O than O a O month O , O i O can O say O that O it O consistently O produces O topnotch O photos O . O",Canon G3.txt,photo[+3],['photo']
221,"recently O , O i O attended O a O `` O flyball O `` O competition O",Canon G3.txt,,[]
222,-- O an O event O that O involves O dogs O running O and O jumping O hurdles O . O,Canon G3.txt,,[]
223,"by O cocking O the O shutter O to O the O halfway O position O and O getting O the O settings O ready O to O shoot O , O i O was O able O to O produce O excellent O stopaction O photos O -- O contrary O to O what O other O reviewers O experienced O . O",Canon G3.txt,photo[+3],['photo']
224,"the O camera O is O a O dream O to O operate O in O automode B-aspect , O but O also O gives O tremendous O flexibility O in O aperture O priority O , O shutter O priority O , O and O manual O modes O . O",Canon G3.txt,"automode[+2],manual mode[+2]","['automode', 'manual mode']"
225,in O the O coastal O redwood O forests O i O was O able O to O use O these O additional O features O along O with O the O macro-focussing O option O to O shoot O wonderful O close-up O photos O of O the O trilliums O and O other O flowers O in O bloom O . O,Canon G3.txt,,[]
226,about O the O only O legitimate O criticsm O from O the O online O reviews O is O that O fact O that O the O lens O really O does O obstruct O the O viewfinder B-aspect . O,Canon G3.txt,viewfinder[-2],['viewfinder']
227,this O effect O is O increased O when O one O buys O and O uses O a O telephoto O doubler O . O,Canon G3.txt,,[]
228,but O who O cares O ? O,Canon G3.txt,,[]
229,i O always O shoot O using O the O lcd O panel O . O,Canon G3.txt,,[]
230,i O can O 't O write O enough O positive O things O about O this O great O little O camera B-aspect ! O,Canon G3.txt,camera[+3],['camera']
231,"being O a O great O fan O of O the O g2 O i O set O out O with O g3 O with O a O somewhat O negative O expectation O , O difficult O as O it O is O to O improve O drastically O on O something O already O as O ' O perfect O ' O as O the O powershot O g2 O . O",Canon G3.txt,,[]
232,but O canon B-aspect never O fails O to O amaze O . O,Canon G3.txt,canon[+3],['canon']
233,some O of O the O great O gains O over O g2 O -- O,Canon G3.txt,,[]
234,1 O . O the O ability O to O selectively O switch O to O raw B-aspect format I-aspect during O record O review O gives O you O incredible O more O post-processing O flexibility O . O,Canon G3.txt,raw format[+2],['raw format']
235,"2 O . O battery B-aspect life I-aspect is O over O 4.5 O hours O , O compared O to O about O 2.5 O hours O for O the O g2 O or O the O 2 O hours O for O most O nikons O . O",Canon G3.txt,battery life[+1],['battery life']
236,3 O . O the O remote O capture O and O fileviewer O software B-aspect bundled O for O photo O capture O is O mind-blowing O . O,Canon G3.txt,software[+2],['software']
237,"looks O sort O of O like O picasa O software O google O it O if O you O dont O know O in O the O interface O and O is O as O easy O to O install O and O operate O as O g2 O 's O , O but O more O intuitive O . O",Canon G3.txt,,[]
238,"4 O . O the O shape B-aspect of O this O device O is O a O little O squarer O , O without O losing O the O weight O which O means O better O balance O and O less O shaking O while O clicking O . O",Canon G3.txt,shape[+1],['shape']
239,a O big O plus O in O my O book O . O,Canon G3.txt,,[]
240,"5 O . O the O 1/200 O sec O , O f5.6 O + O nd O filter O for O highly O exposed O or O very O brightly O lit O environments O . O",Canon G3.txt,,[]
241,the O light O auto-correction O is O awesome O . O,Canon G3.txt,light auto correction[+2],['light auto correction']
242,you O could O take O a O picture B-aspect of O a O stone O glinting O in O the O sun O and O still O avoid O the O shining O glaze O and O get O the O contours O right O . O,Canon G3.txt,picture[+2],['picture']
243,"6 O . O the O g2 O 's O `` O color O effect O `` O exposure O mode O has O now O been O removed O , O the O replacement O is O a O selectable O `` O effect O func O `` O menu O option O available O in O all O exposure O modes O . O",Canon G3.txt,,[]
244,"there O are O six O default O settings O off O , O vivid O , O sepia O , O neutral O , O low O sharpening O , O b O & O w O as O well O as O a O ' O custom O effect O ' O that O allows O you O to O control O sharpening O , O contrast O and O saturation O . O",Canon G3.txt,,[]
245,7 O . O a O new O photostich O software O for O stiching O your O pics O into O a O panoramic O view O . O,Canon G3.txt,,[]
246,i O can O of O course O buy O such O a O tool O off O the O shelves O separately O but O helps O if O it O comes O with O my O camera O . O,Canon G3.txt,,[]
247,"looks O quite O neat O too O suggesting O that O canon O may O have O , O er O , O canonized O it O a O bit O . O",Canon G3.txt,,[]
248,"8 O . O perhaps O inspired O by O the O canon O 's O factory O white-correction O settings O which O were O found O lacking O and O had O to O be O altered O by O a O user O before O the O white O edges O from O buildings O etc O could O be O cleaned O out O , O the O g3 O has O much O sharper O white O offsets O . O",Canon G3.txt,white offset[+2],['white offset']
249,"in O english O , O this O means O that O even O straight O out O of O the O box O , O you O 'll O be O amazed O at O the O pics O you O end O up O taking O . O",Canon G3.txt,,[]
250,"9 O . O in O dim O lit O environs O the O g2 O could O easily O outperform O any O other O camera O , O and O thankfully O g3 O maintains O this O rep O . O",Canon G3.txt,,[]
251,personally O i O believe O it O even O outperforms O the O g2 O in O terms O of O less O haze O and O astonishingly O real O colors O . O,Canon G3.txt,,[]
252,"overall O , O the O g3 B-aspect delivers O what O must O be O considered O the O best O image O quality O of O any O current O > O 4 O megapixel O digicams O , O from O a O detail O , O tonal O balance O and O color O response O point O of O view O . O",Canon G3.txt,g3[+3],['g3']
253,there O 's O really O very O little O about O g3 O images O to O criticize O . O,Canon G3.txt,,[]
254,short O of O the O eos O range O from O canon O or O the O d100s O from O nikon O both O slrs O . O,Canon G3.txt,,[]
255,this O is O quite O simply O the O best O you O can O ask O for O . O,Canon G3.txt,camera[+3][p],['camera']
256,i O love O my O g2 O so O thought O i O would O upgrade O . O,Canon G3.txt,,[]
257,big O mistake O . O,Canon G3.txt,,[]
258,the O g3 O had O problems O focusing O in O low O light O and O would O not O take O the O picture O when O the O shutter O was O pressed O but O after O the O shutter O had O been O released O a O few O seconds O . O,Canon G3.txt,low light focus[-2],['low light focus']
259,got O way O too O many O blurry O pictures O . O,Canon G3.txt,picture[-3],['picture']
260,i O have O returned O the O g3 O actually O i O tried O two O of O them O and O have O my O g2 O ! O,Canon G3.txt,,[]
261,"when O shopping O for O digital O cameras O i O looked O at O the O nikon O cp5700 O , O olympus O c5050 O , O nikon O cp5000 O , O and O the O canon O g3 O . O",Canon G3.txt,,[]
262,"yes O , O all O cameras O except O g3 O were O 5mp O but O i O was O looking O for O a O lot O more O than O just O megapixel O power O . O",Canon G3.txt,,[]
263,"not O only O was O i O was O shopping O for O a O camera O that O would O suit O my O casual O and O artistic O photographic O needs O , O i O had O to O keep O in O mind O that O my O fiance O wanted O to O use O this O camera O as O well O . O",Canon G3.txt,,[]
264,her O main O focus O was O having O a O camera O that O is O easy O to O understand O and O use O . O,Canon G3.txt,,[]
265,the O nikon O 's O are O great O cameras O . O,Canon G3.txt,,[]
266,"+ O they O have O great O optics O cp5700 O has O great O optical O zoom O and O features O , O not O to O mention O take O great O pictures O . O",Canon G3.txt,,[]
267,"- O the O drawbacks O were O that O they O were O not O user O friendly O for O the O casual O photographer O , O the O lcd O screen O is O a O little O too O small O , O cp5000 O does O not O take O photos O in O raw O format O . O",Canon G3.txt,,[]
268,olympus O c5050 O is O a O very O solid O camera O with O a O metal O body O . O,Canon G3.txt,,[]
269,"+ O takes O sharp O 5mp O photo O 's O , O has O great O features O and O relatively O easy O to O use O . O",Canon G3.txt,,[]
270,"- O i O did O n't O care O much O for O the O tilting O lcd O screen O , O it O seemed O very O limited O and O not O very O usefull O . O",Canon G3.txt,,[]
271,photos O had O some O artifacts O and O noise O . O,Canon G3.txt,,[]
272,my O fiance O just O did O n't O like O the O way O it O felt O in O her O hands O . O,Canon G3.txt,,[]
273,we O also O looked O at O the O fuji O fps602 O . O,Canon G3.txt,,[]
274,"nice O camera O but O does O n't O take O as O sharp O as O pictures O i O thought O they O would O , O and O again O . O",Canon G3.txt,,[]
275,fiance O did O n't O like O the O feel O . O,Canon G3.txt,,[]
276,the O canon O g3 O . O,Canon G3.txt,,[]
277,"4mp O , O 4x O optical O zoom O , O takes O absolutely O beautiful O photos O with O detail O that O challenges O all O of O the O above O 5mp O cameras O , O easy O to O understand O and O use B-aspect has O a O great O swivel O lcd O screen O , O a O lot O of O features O and O add-on O options O , O comes O with O great O software B-aspect not O to O be O overlooked O , O and O last O but O by O far O not O least O , O received O my O fiance O 's O stamp O of O approval O two O thumbs O up O ! O",Canon G3.txt,"photo[+3], use[+3], software[+2]","['photo', 'use', 'software']"
278,"a O lot O of O research O went O into O digital O camera O 's O before O i O made O this O purchase O , O and O hands O down O , O the O g3 O had O everything O i O needed O plus O more O . O",Canon G3.txt,,[]
279,"the O other O cameras O were O great O and O i O 'm O sure O many O people O will O beg O to O differ O from O my O observations O , O but O to O each O his O / O her O own O . O",Canon G3.txt,,[]
280,"i O have O no O buyers O remorse O with O this O baby O , O and O i O never O will O . O",Canon G3.txt,,[]
281,"always O remember O , O cameras O do O n't O take O great O pictures O , O people O do O ! O",Canon G3.txt,,[]
282,the O powershot O g3 O is O a O great O camera B-aspect . O,Canon G3.txt,camera[+2],['camera']
283,because O it O can O help O a O so-so O photographer O take O spectacular O photos O ! O,Canon G3.txt,photo[+3],['photo']
284,"4 O megapixels O is O plenty O for O all O but O pros O , O and O you O will O not O be O disappointed O with O the O results O of O this O camera B-aspect . O",Canon G3.txt,camera[+2],['camera']
285,it O 's O slightly O lighter O than O the O g2 O and O packed O with O even O more O features O . O,Canon G3.txt,feature[+1],['feature']
