,text,dataset,aspect_str,aspects
286,make O sure O you O get O a O big O compactflash O card O it O comes O with O a O 32mb O -- O the O 512mb O cards O are O pretty O [ O inexpensive O ] O here O on O amazon.com O and O can O hold O about O 500 O photos O at O a O time O ! O,Canon G3.txt,,[]
287,"the O catch O with O the O canon O g3 O camera O , O and O perhaps O all O of O digital O cameras O is O that O its O unresponsiveness B-aspect will O cause O you O to O miss O precious O shots O . O",Canon G3.txt,unresponsiveness[-2],['unresponsiveness']
288,"prior O to O the O purchase O , O none O of O my O digital O camera O friends O mentioned O the O delay O between O pressing O the O shutter O button O and O the O camera O taking O the O picture O . O",Canon G3.txt,,[]
289,"no O one O told O me O , O but O i O wanted O to O tell O you O . O",Canon G3.txt,,[]
290,this O is O not O the O same O thing O as O a O film O camera O . O,Canon G3.txt,,[]
291,and O while O it O is O cool O and O fun O and O has O no O film O processing O costs O . O,Canon G3.txt,,[]
292,they O have O n't O got O all O the O bugs O worked O out O just O yet O . O,Canon G3.txt,,[]
293,"most O of O the O time O , O my O g3 O is O a O well-behaved O camera O . O",Canon G3.txt,,[]
294,"but O once O in O a O while O , O i O run O up O against O it O 's O major O flaw O : O",Canon G3.txt,,[]
295,it O sometimes O takes O the O picture O at O some O indefinite O period O of O time O after O you O press O the O shutter O button O . O,Canon G3.txt,delay[-1][u],['delay']
296,i O am O not O talking O milliseconds O . O,Canon G3.txt,,[]
297,picture O this O : O,Canon G3.txt,,[]
298,"your O child O is O going O to O do O a O cannonball O off O the O diving O board O , O so O you O compose O the O shot O and O wait O for O your O moment O . O",Canon G3.txt,,[]
299,"when O it O arrives O , O you O press O the O shutter O release O . O",Canon G3.txt,,[]
300,"the O moment O passes O , O and O then O your O new O g3 O camera O takes O the O shot O . O",Canon G3.txt,,[]
301,perhaps O there O is O a O way O around O this O delay O . O,Canon G3.txt,,[]
302,"some O feature O i O could O turn O on O or O off O , O or O some O attachment O i O could O get O . O",Canon G3.txt,,[]
303,"yes O , O i O push O the O button O down O halfway O first O to O avoid O the O autofocus O delay O . O",Canon G3.txt,,[]
304,"yes O , O i O have O red-eye O off O , O and O yes O , O i O 've O tried O adding O a O flash O . O",Canon G3.txt,,[]
305,"but O after O trying O many O adjustments O , O the O camera O remains O unresponsive O when O compared O to O any O film-based O camera O . O",Canon G3.txt,,[]
306,i O own O another O canon O - O an O eos O 35mm O film O camera O . O,Canon G3.txt,,[]
307,it O focuses O in O a O snap O . O,Canon G3.txt,,[]
308,"dim O or O bright O , O it O would O never O take O a O picture O after O the O birthday O candles O had O blown O out O , O after O the O tae O kwon O do O kick O broke O the O board O . O",Canon G3.txt,,[]
309,canon O 's O g3 O does O it O consistently O . O,Canon G3.txt,delay[-2][u],['delay']
310,"it O feels O slow O to O focus B-aspect , O and O unbearably O slow O to O shoot B-aspect . O",Canon G3.txt,"focus[-2], shoot[-2]","['focus', 'shoot']"
311,i O challenge O anyone O who O is O not O in O direct O sun O at O the O beach O at O noon O to O say O it O is O fast O and O responsive O . O,Canon G3.txt,,[]
312,"and O so O i O must O ask O , O what O are O cameras O for O ? O",Canon G3.txt,,[]
313,what O task O do O they O perform O ? O,Canon G3.txt,,[]
314,cameras O capture O moments O . O,Canon G3.txt,,[]
315,they O stop O time O . O,Canon G3.txt,,[]
316,"because O once O the O moment O is O gone O , O it O is O not O coming O back O . O",Canon G3.txt,,[]
317,"the O dive O , O the O kick O , O the O blow-out-the-candles O moments O are O , O to O me O , O the O reason O for O cameras O . O",Canon G3.txt,,[]
318,"a O 35mm O film O camera O captures O the O moments O you O want O , O while O these O digital O cameras O my O friends O now O inform O me O all O seem O to O capture O the O moment O immediately O following O the O one O you O asked O to O capture O . O",Canon G3.txt,,[]
319,"not O all O the O time O , O but O often O enough O to O be O a O real O problem O . O",Canon G3.txt,,[]
320,"like O i O said O , O when O the O moment O is O gone O , O it O is O gone O . O",Canon G3.txt,,[]
321,so O buy O the O g3 O . O,Canon G3.txt,,[]
322,"buy O it O for O fun O , O for O lack O of O processing O , O because O you O want O to O use O iphoto O , O or O whatever O . O",Canon G3.txt,,[]
323,"but O do O not O assume O , O as O i O did O , O that O the O g3 O has O the O same O ability O as O [ O your O current O film O camera O ] O to O stop O the O moment O you O choose O . O",Canon G3.txt,,[]
324,"from O a O dime O store O disposable O to O a O top O of O the O line O eos O , O all O film O cameras O share O this O ability O to O capture O the O moment O you O tell O them O to O . O",Canon G3.txt,,[]
325,"unfortunately O , O this O digital O moment-capturing O device O called O the O g3 B-aspect sometimes O captures O the O moment O after O the O one O you O wanted O . O",Canon G3.txt,g3[-2],['g3']
326,this O is O my O first O digital O camera B-aspect and O i O could O n't O be O happier O . O,Canon G3.txt,camera[+3],['camera']
327,i O have O but O plan O on O selling O my O rebel O ti O and O all O of O the O equipment O with O it O . O,Canon G3.txt,,[]
328,i O love O the O quality O of O the O pictures O . O,Canon G3.txt,picture quality[+2],['picture quality']
329,they O look O fantastic O . O,Canon G3.txt,picture quality[+2][p],['picture quality']
330,i O can O take O better O pictures O with O this O then O my O rebel O ti O with O a O good O lens O . O,Canon G3.txt,,[]
331,it O 's O just O easier O for O me O since O i O can O make O on O the O fly O adjustments O . O,Canon G3.txt,,[]
332,the O canon O g3 O is O perhaps O the O best O 4mp B-aspect camera I-aspect out O there O . O,Canon G3.txt,4mp camera[+2],['4mp camera']
333,"i O 've O tried O the O sony O s85 O with O the O carl O zeiss O lens O , O but O the O pictures O were O too O digital O . O",Canon G3.txt,,[]
334,"with O canon O , O you O get O pictures O that O appear O to O be O photos O , O not O still O camcorder O shots O . O",Canon G3.txt,picture[+2],['picture']
335,i O love O the O eos O based O controls O and O easy O menus O . O,Canon G3.txt,"control[+2],menu[+2]","['control', 'menu']"
336,i O do O n't O need O to O go O into O exhustive O review O of O this O camera O . O,Canon G3.txt,,[]
337,many O before O me O have O done O that O already O . O,Canon G3.txt,,[]
338,i O agree O with O the O positive O reviews O . O,Canon G3.txt,,[]
339,but O there O are O two O things O i O do O n't O like O about O the O camera O that O were O not O mentioned O in O any O previous O reviews O . O,Canon G3.txt,,[]
340,1 O the O included O lens B-aspect cap I-aspect is O very O loose O on O the O camera O . O,Canon G3.txt,lens cap[-2],['lens cap']
341,"though O the O instruction O booklet O says O that O the O camera O should O display O `` O lens O `` O when O the O cap O and O the O camera O are O both O on O , O the O camera O lens O extends O out O and O simply O takes O the O lens O cap O off O by O itself O . O",Canon G3.txt,,[]
342,"i O 'm O concerned O that O with O the O easily O removed O lens O cap O , O i O may O damage O the O lens O . O",Canon G3.txt,,[]
343,very O cheaply O made O . O,Canon G3.txt,,[]
344,"2 O the O body B-aspect construction O - O buttons O , O casing O , O etc O , O are O too O plastic O . O",Canon G3.txt,body[-2],['body']
345,the O g2 O was O better O in O this O respect O . O,Canon G3.txt,,[]
346,it O had O a O heavier O and O more O sturdy O casing B-aspect . O,Canon G3.txt,casing[-2],['casing']
347,"despite O these O grieps O , O i O still O recommend O the O camera O . O",Canon G3.txt,,[]
348,i O used O a O canon O powershot O s20 O for O about O 2.5 O years O and O loved O it O ! O,Canon G3.txt,,[]
349,"there O were O a O few O flaws O that O i O learned O to O deal O with O and O took O thousands O of O pictures O around O the O world O , O losing O a O few O that O i O really O regretted O . O",Canon G3.txt,,[]
350,"i O finally O decided O to O upgrade O , O and O started O my O research O . O",Canon G3.txt,,[]
351,"canon O was O an O obvious O choice O , O but O i O did O not O want O to O limit O my O decision O , O so O started O researching O all O brands O that O would O take O my O microdrives O . O",Canon G3.txt,,[]
352,"i O researched O , O held O , O tested O , O and O observed O 3 O different O brands O . O",Canon G3.txt,,[]
353,"needless O to O say O , O the O canon O won O , O hands O down O . O",Canon G3.txt,,[]
354,this O camera O performs O like O i O can O not O believe O ! O,Canon G3.txt,,[]
355,"i O bought O it O for O my O trip O to O beunos O aires O , O and O also O used O it O at O the O iguazu O falls O , O and O could O not O have O asked O for O more O perfect O performance B-aspect ! O",Canon G3.txt,performance[+3][p],['performance']
356,"it O was O too O new O to O have O learned O much O about O the O advanced O features O , O so O i O generally O used O the O auto O mode O . O",Canon G3.txt,,[]
357,"this O camera B-aspect is O worth O every O penny O , O and O i O highly O recommend O it O ! O",Canon G3.txt,camera[+3],['camera']
358,another O point O of O note O : O the O battery B-aspect life I-aspect is O incredible O ! O,Canon G3.txt,battery life[+3],['battery life']
359,"i O did O not O have O a O backup O battery O , O and O had O no O need O for O one O . O",Canon G3.txt,,[]
360,"i O did O have O ability O to O charge O it O every O night O , O so O do O n't O know O how O long O it O would O have O actually O gone O before O dying O . O",Canon G3.txt,,[]
361,this O camera O will O stay O with O me O for O years O ! O,Canon G3.txt,,[]
362,i O 've O been O looking O to O buy O a O digital O camera O for O a O long O time O and O v O = O finally O decided O that O now O was O the O time O . O,Canon G3.txt,,[]
363,"after O a O lot O of O research O , O i O decided O on O the O g3 O . O",Canon G3.txt,,[]
364,am O i O ever O glad O that O i O decided O on O this O camera B-aspect ! O,Canon G3.txt,camera[+2],['camera']
365,"i O 've O only O had O it O a O week O , O but O so O far O , O everything O about O this O camera B-aspect is O making O me O happy O . O",Canon G3.txt,camera[+2],['camera']
366,forget O the O fact O that O it O 'll O probably O take O me O a O year O to O figure O out O all O the O features O this O camera O has O to O offer O . O,Canon G3.txt,,[]
367,i O 've O been O able O to O change O modes O on O this O thing O without O even O looking O at O the O manual O . O,Canon G3.txt,,[]
368,very O intuitive O menus O are O a O big O plus O on O this O camera O . O,Canon G3.txt,menu[+2],['menu']
369,"i O charged O it O up O the O day O i O got O it O , O took O a O bunch O of O pictures O and O i O do O n't O think O the O battery O indicator O has O budged O from O fully O charged O . O",Canon G3.txt,,[]
370,the O standard O battery B-aspect include O with O the O g3 O is O a O camcorder O battery B-aspect that O will O allow O me O to O take O pictures O all O day O without O worrying O about O charging O . O,Canon G3.txt,battery[+2],['battery']
371,i O was O worried O about O this O after O seeing O a O friend O change O batteries O on O his O olympus O after O about O 20-30 O pictures O . O,Canon G3.txt,,[]
372,"the O optical B-aspect zoom I-aspect is O awesome O , O and O the O viewfinder B-aspect reflects O the O settings O of O the O zoom O . O",Canon G3.txt,"optical zoom[+3],viewfinder[+1]","['optical zoom', 'viewfinder']"
373,"one O little O minor O flaw O with O this O camera O is O that O the O lens O is O visible O in O the O viewfinder B-aspect , O but O does O not O detract O from O the O image O at O all O . O",Canon G3.txt,viewfinder[-2],['viewfinder']
374,"as O i O said O , O this O is O the O last O digital O camera O i O 'll O buy O , O and O if O you O are O in O the O market O one O , O my O advice O is O to O buy O the O best O thing O you O can O afford O and O keep O it O forever O . O",Canon G3.txt,,[]
375,"these O things O may O get O a O lot O better O in O the O future O , O but O from O what O i O 've O seen O in O the O last O few O years O , O the O technology O for O digital O cameras O is O n't O advancing O at O the O pace O of O pc O 's O , O phones O and O hard O drives O . O",Canon G3.txt,,[]
376,the O best O 4 O megapixel/4x O optical O zoom O camera B-aspect available O and O fairly O easy O to O use O . O,Canon G3.txt,camera[+3],['camera']
377,highly O recommended O . O,Canon G3.txt,,[]
378,"for O more O info O on O digital O cameras O , O go O to O dpreviews O . O",Canon G3.txt,,[]
379,you O can O read O the O other O reviews O for O specs O and O performance O opinions O . O,Canon G3.txt,,[]
380,"i O was O perfectly O happy O with O my O g2 O , O so O why O did O i O trade O up O to O the O g3 O ? O",Canon G3.txt,,[]
381,because O this O camera B-aspect is O beautiful O . O,Canon G3.txt,camera[+3],['camera']
382,the O g2 O was O slightly O curvy O with O a O champagne O finish O -- O very O homely O . O,Canon G3.txt,,[]
383,the O g3 O looks O like O a O work O of O art O ! O,Canon G3.txt,look[+3],['look']
384,"its O silver O magnesium O finish B-aspect is O stunning O , O and O the O sharp O lines O and O excellent O grip O are O better O than O any O other O camera O i O 've O seen O . O",Canon G3.txt,finish[+3],['finish']
385,"the O little O digital O elphs O were O the O best-designed O , O most-elegant O cameras O until O the O g3 O came O along O and O squashed O them O . O",Canon G3.txt,,[]
386,this O is O my O first O digital O camera O . O,Canon G3.txt,,[]
387,i O am O very O pleased O with O it O so O far O . O,Canon G3.txt,camera[+2][p],['camera']
388,i O wanted O something O that O is O able O to O take O high O quality O photos O but O not O be O so O bulky O that O i O would O wind O up O leaving O it O at O home O all O the O time O . O,Canon G3.txt,,[]
389,this O seemed O like O a O really O good O compromise O . O,Canon G3.txt,,[]
390,"i O compared O it O to O the O olympus O c5050z O , O the O sony O dcs-f O 717 O and O the O nikon O 5700 O . O",Canon G3.txt,,[]
391,"based O on O the O cameras O features O and O about O dozen O online O reviews O , O this O one O seemed O like O the O best O all O round O deal O . O",Canon G3.txt,,[]
392,it O is O not O perfect O though O . O,Canon G3.txt,,[]
393,here O are O the O shortcomings O i O have O noticed O so O far O : O,Canon G3.txt,,[]
394,it O would O have O been O a O much O easier O choice O if O this O were O 5mp O camera O . O,Canon G3.txt,,[]
395,you O can O see O the O lens O barrel O in O the O view-finder O . O,Canon G3.txt,viewfinder[-2],['viewfinder']
396,"i O knew O this O before O hand O , O and O it O is O not O that O bad O there O is O no O tiff B-aspect format I-aspect . O",Canon G3.txt,tiff format[-2],['tiff format']
397,that O would O be O a O nice O compromise O between O jpeg O and O raw O . O,Canon G3.txt,,[]
398,"to O save O a O picture O as O raw O , O you O have O to O have O the O display O on O , O this O seems O like O a O waste O of O battery O power O . O",Canon G3.txt,,[]
399,it O seems O to O me O that O after O the O focus O and O metering O are O complete O there O is O quite O a O lag B-aspect before O the O shutter O ? O,Canon G3.txt,lag[-2],['lag']
400,again O this O is O my O first O digital O camera O and O maybe O that O is O just O how O they O all O are O . O,Canon G3.txt,,[]
401,for O those O of O you O using O a O mac O in O os O x+ O there O is O no O twain O utility O to O download O your O pics O directly O into O photoshop O . O,Canon G3.txt,,[]
402,it O is O very O simple O to O import B-aspect via O iphoto O 2 O and O then O move O them O to O photoshop O . O,Canon G3.txt,import[+2],['import']
403,"i O have O not O spent O much O time O with O the O included O software O , O so O i O do O n't O know O what O to O say O about O it O other O than O it O seems O ok O . O",Canon G3.txt,,[]
404,i O am O quite O happy O with O the O camera B-aspect . O,Canon G3.txt,camera[+2],['camera']
405,it O comes O with O a O clearly O written O manual B-aspect and O the O learning O curve O is O not O too O too O steep O . O,Canon G3.txt,manual[+2],['manual']
406,"yes O , O i O recommend O it O over O the O competition O . O",Canon G3.txt,camera[+2][p],['camera']
407,"best O camera B-aspect ever O . O from O the O image O quality O , O color O , O function O , O i O can O say O almost O everything O . O",Canon G3.txt,camera[+3],['camera']
408,"this O camera O has O a O cool O stitch O pictures O feature O , O to O find O out O more O just O log O on O to O canon O 's O website O . O",Canon G3.txt,stitch picture[+2],['stitch picture']
409,i O had O an O olympus O digital O camera O before O and O it O was O nothing O compared O to O this O . O,Canon G3.txt,,[]
410,"for O those O of O you O who O already O bought O this O camera O , O i O suggest O you O buy O a O hi-ti O dye-sub O photo O printer O . O",Canon G3.txt,,[]
411,i O do O n't O write O many O reviews O but O i O 'm O compelled O to O do O so O with O this O camera O . O,Canon G3.txt,,[]
412,"first O and O foremost O , O it O will O take O better O pic O 's O than O most O film O camera O 's O . O",Canon G3.txt,picture[+2],['picture']
413,save O them O on O computer O and O print O out O just O the O ones O who O want O . O,Canon G3.txt,,[]
414,duplicates O are O a O no O brainer O and O cheap O . O,Canon G3.txt,,[]
415,no O more O wasted O time O and O money O developing O rolls O of O pic O 's O for O just O a O couple O of O keepers O . O,Canon G3.txt,,[]
416,crop O and O enlarge O the O best O at O practically O no O extra O cost O or O time O . O,Canon G3.txt,,[]
417,"the O technology O is O finally O here O folks O , O to O make O your O photo O life O easier O . O",Canon G3.txt,,[]
418,a O great O new O use O for O that O underutilized O computer O . O,Canon G3.txt,,[]
419,a O digital O camera O will O stay O at O home O if O its O a O hassle O to O use O . O,Canon G3.txt,,[]
420,"poor O quality O pics O , O short O battery O life O , O slow O time O consuming O uploads O and O printing O will O ruin O the O digital O camera O experience O and O keep O you O buying O film O . O",Canon G3.txt,,[]
421,this O camera B-aspect has O none O of O these O flaws O and O will O be O something O you O 'll O use O all O the O time O . O,Canon G3.txt,camera[+2],['camera']
422,"my O wife O shuns O all O new O technology O and O compained O when O i O brought O this O home O , O but O now O she O 's O forever O asking O for O the O digital O camera O . O",Canon G3.txt,,[]
423,"and O i O let O my O kids O shoot O as O many O pics O as O they O want O , O let O them O review O them O on O the O camera O and O just O print O the O good O ones O which O are O not O many O . O",Canon G3.txt,,[]
424,get O the O canon O 850 O printer O and O an O ex O flash O . O,Canon G3.txt,,[]
425,"in O short O , O i O have O a O new O slr O with O an O expensive O lens O and O several O film O point O and O shoots O . O",Canon G3.txt,,[]
426,i O have O n't O used O any O of O them O since O i O got O the O g3 O . O,Canon G3.txt,,[]
427,"unless O your O a O professional O , O now O you O will O need O only O one O camera O . O this O one O . O",Canon G3.txt,,[]
428,"i O spent O a O lot O of O time O comparing O different O cameras O , O and O i O realized O that O there O is O not O such O thing O as O the O best O digital O camera O . O",Canon G3.txt,,[]
429,you O can O always O spend O more O money O to O get O a O better O one O . O,Canon G3.txt,,[]
430,"however O , O for O a O $ O 600 O - O $ O 800 O budget O , O i O think O this O camera B-aspect is O an O excellent O choice O . O",Canon G3.txt,camera[+3],['camera']
431,"it O has O a O beautiful O design B-aspect , O lots O of O features O , O very O easy O to O use B-aspect , O very O configurable O and O customizable O , O and O the O battery B-aspect duration O is O amazing O ! O",Canon G3.txt,"design[+2], feature[+2],use[+1][u],battery[+2]","['design', 'feature', 'use', 'battery']"
432,"also O , O the O display B-aspect is O `` O hinged O `` O and O it O can O be O placed O in O a O myriad O of O positions O , O or O to O protect O it O against O any O damage O . O",Canon G3.txt,display[+2],['display']
433,excellent O idea O ! O,Canon G3.txt,,[]
434,"one O bad O thing O is O that O it O comes O with O a O pitiful O 32mb O compactflash B-aspect card O , O and O for O most O purposes O , O it O is O not O enough O . O",Canon G3.txt,compactflash[-2],['compactflash']
435,"however O , O it O seems O that O this O is O the O general O rule O for O most O digital O cameras O . O",Canon G3.txt,,[]
436,another O good O thing O is O that O this O camera O seems O to O introduce O much O less O noise B-aspect in O dark O places O than O others O i O 've O seen O . O,Canon G3.txt,noise[+2],['noise']
437,i O have O owned O this O camera B-aspect for O a O short O time O and O would O n't O give O it O up O for O anything O . O,Canon G3.txt,camera[+2],['camera']
438,it O surpasses O my O greatest O expectations O in O a O 4mp O camera B-aspect .. O,Canon G3.txt,camera[+2],['camera']
439,bought O this O product O about O a O month O ago O and O have O used O it O in O a O variety O of O situations O . O,Canon G3.txt,,[]
440,in O general O it O is O easy O to O use B-aspect and O well O laid O out O . O,Canon G3.txt,"use[+1][u],design[+1][u]","['use', 'design']"
441,for O `` O cool O factor O '' O buffs O it O looks O and O feels O like O a O small O plastic O brick O brick O and O does O n't O have O any O wow O factor O . O,Canon G3.txt,,[]
442,it O makes O up O for O this O by O being O extremely O easy O to O use B-aspect with O well O laid O out O controls O that O can O be O learned O quickly O . O,Canon G3.txt,"use[+3],control[+2]","['use', 'control']"
443,the O g3 O has O most O if O not O all O of O the O features O that O you O would O want O from O a O semi-pro O / O pro O slr O with O a O good O range O of O manual O options O for O those O who O know O something O about O photography O . O,Canon G3.txt,feature[+2],['feature']
444,"in O the O hands O of O someone O who O does O n't O , O it O will O yield O good O results O on O idiot O program O / O auto B-aspect mode I-aspect . O",Canon G3.txt,auto mode[+1],['auto mode']
445,"my O wife O , O who O has O never O used O a O camera O before O , O picked O it O up O and O soon O got O the O hang O of O the O fact O that O if O you O do O n't O like O what O you O have O created O you O just O delete O and O try O again O . O",Canon G3.txt,,[]
446,the O photos O she O took O are O better O than O the O results O i O got O from O my O nikon O slr O and O range O of O lenses O ! O,Canon G3.txt,,[]
447,this O is O a O big O plus O for O those O who O a O shifting O to O digital O and O the O g3 O 's O large O mobile O screen O helps O with O this O . O,Canon G3.txt,,[]
448,negative O points O : O,Canon G3.txt,,[]
449,the O included O memory B-aspect card I-aspect is O too O small O . O,Canon G3.txt,memory card[-2],['memory card']
450,"go O out O and O get O a O 256meg O card O , O it O 's O worth O the O expense O . O",Canon G3.txt,,[]
451,it O is O made B-aspect of O plastic O . O,Canon G3.txt,made[-2],['made']
452,"for O those O who O are O used O to O brass O cameras O that O can O be O dropped O , O picking O up O a O camera O like O the O g3 O is O an O unnerving O experience O . O",Canon G3.txt,,[]
453,"this O is O by O no O means O unique O to O this O model O , O i O 'm O sure O . O",Canon G3.txt,,[]
454,the O zoom O lens B-aspect unit O feels O fragile O and O it O is O worth O buying O a O good O camera O bag O if O you O are O going O put O to O carry O it O round O a O lot O . O,Canon G3.txt,lens[-1],['lens']
455,this O is O not O a O handbag O camera O . O,Canon G3.txt,,[]
456,"while O light O , O it O will O not O easily O go O in O small O handbags O or O pockets O . O",Canon G3.txt,size[-1][u],['size']
457,the O function O lever B-aspect - O the O one O which O switches O between O capture O and O view O mode O feels O fragile O . O,Canon G3.txt,lever[-1],['lever']
458,"flash B-aspect - O as O with O all O built-in O flashes O in O small O cameras O , O you O get O overilluminated O main O subjects O with O depth O being O lost O . O",Canon G3.txt,flash[-1],['flash']
459,the O g3 O has O a O shoe O which O will O take O other O powerful O and O expensive O canon O flashes O that O will O allow O bounce O and O reflected O flash O photography O . O,Canon G3.txt,,[]
460,the O strap B-aspect is O horrible O and O gets O in O the O way O of O parts O of O the O camera O you O need O access O to O . O,Canon G3.txt,strap[-2],['strap']
461,"if O you O can O afford O this O camera O , O you O can O afford O to O get O a O better O strap O elsewhere O - O a O very O minor O quibble O . O",Canon G3.txt,,[]
462,good O points O : O,Canon G3.txt,,[]
463,the O functionality O on O this O camera B-aspect is O mind-blowing O . O,Canon G3.txt,camera[+2],['camera']
464,canon O have O packed O a O lot O in O here O and O the O options O and O controls O are O easy O to O use O and O logically O laid O out O . O,Canon G3.txt,"option[+1}, control[+1]","['option', 'control']"
465,learning B-aspect how O to O use O it O will O not O take O very O long O . O,Canon G3.txt,learning[+1],['learning']
