,text,dataset,aspect_str,aspects
147,"There O is O no O comparison O , O the O chanp O is O easy O and O smell O free O , O the O genie O was O difficult O to O use O one O handed O which O is O absolutly O vital O if O you O have O a O little O one O on O a O changing O pad O and O there O was O a O deffinite O odor B-aspect eminating O from O the O genie O plus O we O found O that O the O quick O tie O garbage O bags O where O the O ties O are O integrated O into O the O bag O work O really O well O because O there O is O n't O any O added O bulk O around O the O sealing O edge O of O the O champ B-aspect . O",Diaper Champ.txt,"champ[+3],odor[+3][cs]","['champ', 'odor']"
148,I O love O this O pail B-aspect ! O,Diaper Champ.txt,pail[+3],['pail']
149,"No O smell B-aspect , O easy O to O use O with O one O hand O free O , O and O best O of O all O it O uses O regular O tall O kitchen O garbage B-aspect bags I-aspect so O you O do O n't O get O suckered O in O to O using O only O the O bags O made O for O the O pail O that O are O imposible O to O find O ! O",Diaper Champ.txt,"smell[+3],ease of use[+3],garbage bags[+3][u]","['smell', 'ease of use', 'garbage bags']"
150,"I O have O heard O that O it O will O eventually O become O my O sons O favorite O place O to O put O his O toys O when O he O becomes O a O toddler O , O but O I O 've O got O 2 O years O to O worry O about O that O and O I O 'm O sure O I O 'll O figure O out O preventative O measures O like O any O other O mom O . O",Diaper Champ.txt,,[]
151,4 O months O later O . O,Diaper Champ.txt,,[]
152,I O still O like O it O but O do O n't O think O it O rates O the O 5 O stars O I O gave O it O but O ca O n't O change O that O . O,Diaper Champ.txt,,[]
153,Once O your O child O goes O on O to O solid O foods O BEWARE O ! O,Diaper Champ.txt,,[]
154,Solid O food O poop O is O VERY O STINKY O and O this O diaper B-aspect pail I-aspect does O n't O really O contain O the O smell O . O,Diaper Champ.txt,diaper pail[-2],['diaper pail']
155,"I O still O like O it O a O lot O and O am O not O changing O it O for O another O , O but O it O is O sort O of O stinky O . O",Diaper Champ.txt,diaper pail[-2][u],['diaper pail']
156,I O think O it O 's O great O . O,Diaper Champ.txt,diaper pail[+3][p],['diaper pail']
157,I O just O wished O that O it O did O n't O fill O up O so O fast O ! O,Diaper Champ.txt,diaper pail[-2],['diaper pail']
158,It O definitely O keeps O the O smell O out O . O,Diaper Champ.txt,diaper pail[+2],['diaper pail']
159,But O now O that O she O is O eating O solids O the O odor B-aspect is O escaping O out O and O we O are O constantly O using O airfreshner O . O,Diaper Champ.txt,odor[-2],['odor']
160,First O 4 O months O it O was O in O our O bedroom O and O we O did O not O even O smell O any O odor B-aspect . O,Diaper Champ.txt,odor[+1][u],['odor']
161,"Bottom O line O if O you O buy O this O for O your O newborn O , O it O is O fine O . O",Diaper Champ.txt,,[]
162,But O be O prepared O to O buy O something O else O diaper O genie O ? O which O can O trap O the O odor B-aspect better O . O,Diaper Champ.txt,odor[-1],['odor']
163,Every O time O ! O,Diaper Champ.txt,,[]
164,The O diaper B-aspect champ I-aspect is O the O best O ! O,Diaper Champ.txt,diaper champ[+3],['diaper champ']
165,Having O used O it O with O 2 O children O 13 O months O apart O . O,Diaper Champ.txt,,[]
166,I O can O honestly O speak O to O its O worth O ! O,Diaper Champ.txt,,[]
167,"I O have O tried O other O pails O , O but O none O have O compared O positively O to O the O Champ B-aspect . O",Diaper Champ.txt,Champ[+3],['Champ']
168,1 O The O champ O is O easy O to O use B-aspect . O,Diaper Champ.txt,use[+3],['use']
169,One O pail O that O I O used O was O so O difficult O to O change O the O bag O and O insert O the O dirty O diaper O . O,Diaper Champ.txt,,[]
170,You O had O to O remove O the O entire O lid O and O lay O it O on O the O floor O which O led O to O my O toddler O running O away O with O it O which O is O gross O while O trying O to O fit O the O bag O correctly O into O the O slot O . O,Diaper Champ.txt,,[]
171,"For O diaper O disposal O , O you O had O to O push O a O button O and O the O lid O would O or O would O not O pop O open O . O",Diaper Champ.txt,,[]
172,With O the O Champ B-aspect all O you O had O to O do O was O drop O the O dirty O diaper O into O the O opening O and O flip O the O lid O . O,Diaper Champ.txt,Champ[+2][u],['Champ']
173,It O was O so O easy O my O toddler O would O dispose B-aspect of O her O on O diapers O . O,Diaper Champ.txt,dispose[+2],['dispose']
174,The O Champ O also O has O hinges O for O you O to O place O a O new O bag O . O,Diaper Champ.txt,,[]
175,2 O The O Champ O uses O regular O store B-aspect bags I-aspect . O,Diaper Champ.txt,store bags[+3][u],['store bags']
176,You O do O not O have O to O waste O money O or O time O trying O to O purchase O special O bags O for O the O Champ B-aspect . O,Diaper Champ.txt,Champ[+3],['Champ']
177,You O can O save O your O bags O from O your O shopping O trip O and O insert O them O into O the O Champ O . O,Diaper Champ.txt,,[]
178,"Special O bags O are O expensive O , O hard O to O find O , O and O you O never O have O enough O . O",Diaper Champ.txt,,[]
179,This O will O never O be O a O problem O with O the O Champ O . O,Diaper Champ.txt,,[]
180,Do O n't O Caregivers O need O more O simplicity O in O their O lives O ? O,Diaper Champ.txt,,[]
181,The O Champ O gives O you O peace O of O mind O and O wallet O . O,Diaper Champ.txt,,[]
182,3The O Champ B-aspect is O Odor O Free O for O at O least O 15 O months O . O,Diaper Champ.txt,Champ[+3],['Champ']
183,The O Champ B-aspect did O not O start O letting O a O little O odor O through O until O well O over O a O year O . O,Diaper Champ.txt,Champ[+2],['Champ']
184,I O can O not O speak O to O the O accuracy O of O its O odor O containing O capabilities O due O to O it O was O working O overtime O with O 2 O childrens O diapers O . O,Diaper Champ.txt,,[]
185,If O you O have O only O one O child O the O Champ O may O last O you O until O the O child O is O out O of O diapers O . O,Diaper Champ.txt,,[]
186,The O other B-aspect pail I-aspect I O used O started O to O smell O after O 2 O weeks O of O use O . O,Diaper Champ.txt,other pail[-2][cc],['other pail']
187,"Regardless O to O this O fact O , O I O believe O the O Champ B-aspect is O the O best O way O to O go O . O",Diaper Champ.txt,Champ[+3],['Champ']
188,The O positives O outway O the O negatives O . O,Diaper Champ.txt,,[]
189,There O probably O is O n't O a O pail O out O on O the O market O that O does O n't O get O smelly O after O a O while O . O,Diaper Champ.txt,,[]
190,Let O the O Champ B-aspect win O you O over O ! O,Diaper Champ.txt,Champ[+3],['Champ']
191,My O biggest O concern O was O would O this O truly O control O the O odor O and O yes O it O did O . O,Diaper Champ.txt,,[]
192,dirty O diapes O and O soaked O diapers O . O,Diaper Champ.txt,,[]
193,I O only O noticed O an O odor O one O time O and O that O was O because O I O did O not O close O thelid O when O I O changed O out O the O bag O . O,Diaper Champ.txt,,[]
194,No O need O for O deodorizers O . O,Diaper Champ.txt,odor[+3],['odor']
195,I O use O the O regular O kitchen O trash O bags O and O it O is O so O easy O to O empty B-aspect . O,Diaper Champ.txt,empty[+3],['empty']
196,even O did O while O daughter O sleep O and O no O noise B-aspect ! O,Diaper Champ.txt,noise[+3],['noise']
197,I O use O the O scented O bags O and O even O if O I O do O n't O no O smell B-aspect ! O,Diaper Champ.txt,smell[+3],['smell']
198,This O holds O alot O and O does O not O take O up O alot O of O space B-aspect . O,Diaper Champ.txt,space[+3][u],['space']
199,"When O my O wife O and O I O got O the O Diaper O Champ O , O we O thought O that O it O would O work O perfectly O . O",Diaper Champ.txt,,[]
200,"We O read O the O reviews O on O and O saw O that O people O liked O it O much O better O then O the O Diaper O Genie O , O but O I O 'm O not O 100 O % O sure O . O",Diaper Champ.txt,,[]
201,"We O found O that O when O you O put O a O dirty O diaper O into O the O top B-aspect loader I-aspect , O there O was O a O tendency O to O get O streaks O which O would O then O get O on O the O plunger O which O would O then O have O to O get O cleaned O each O time O it O was O used O . O",Diaper Champ.txt,top loader[-2],['top loader']
202,We O resorted O to O using O small O plastic O bags O to O store O the O dirty O diapers O and O dumping O them O in O a O trash O can O and O using O the O Diaper B-aspect Champ I-aspect for O wet O diapers O only O . O,Diaper Champ.txt,Diaper Champ[-2],['Diaper Champ']
203,We O also O had O a O problem O with O diaper B-aspect wipes I-aspect getting O caught O when O the O top O was O flipped O . O,Diaper Champ.txt,diaper wipes[-2],['diaper wipes']
204,This O eventually O ruined O the O foam O pad O that O is O applied O to O the O flip O top O to O keep O odors O in O . O,Diaper Champ.txt,,[]
205,I O had O to O go O and O pull O the O crumpled O foam O out O just O so O we O could O turn O the O lid O . O,Diaper Champ.txt,,[]
206,"But O like O I O stated O , O its O better O then O a O trash O can O , O but O I O 'm O not O sure O if O its O better O then O the O Diaper O Genie O . O",Diaper Champ.txt,Diaper Champ[+1][cs],['Diaper Champ']
207,"It O holds O almost O a O week O 's O worth O of O diapers B-aspect , O and O you O do O n't O need O expensive O refills B-aspect - O any O kitchen O bags O work O . O",Diaper Champ.txt,"diapers[+3],refills[+3]","['diapers', 'refills']"
208,"At O first O I O had O a O problem O with O some O smell B-aspect , O then O I O realized O if O you O flip O the O lid O back O and O always O keep O the O same O side O facing O in O - O then O there O is O no O smell B-aspect at O all O ! O",Diaper Champ.txt,smell[+2],['smell']
209,It O is O also O to O wipe O clean O if O you O do O get O the O chute O a O bit O dirty O . O,Diaper Champ.txt,,[]
210,"I O second O that O you O just O need O to O fold O up O the O diaper O with O wipes O inside O neatly O , O but O that O is O not O a O big O deal O . O",Diaper Champ.txt,,[]
211,"The O latch O is O n't O terribly O difficult O , O and O I O would O n't O want O it O to O be O too O easy O since O it O sits O in O my O son O 's O room O . O",Diaper Champ.txt,,[]
212,She O said O her O sister O had O the O Diaper O Champ O and O that O it O took O regular O garbage O bags O and O worked O just O as O well O . O,Diaper Champ.txt,,[]
213,"Personally O , O I O am O VERY O pleased O with O the O Diaper B-aspect Champ I-aspect . O",Diaper Champ.txt,Diaper Champ[+3],['Diaper Champ']
214,It O is O mindless O to O operate B-aspect . O,Diaper Champ.txt,operate[+3][u],['operate']
215,It O takes O garage O bags O that O we O use O elsewhere O in O the O abode O . O,Diaper Champ.txt,,[]
216,"It O does O n't O stink O , O ever O like O some O have O assumed O since O it O does O n't O wrap O each O diaper O into O its O own O neat O little O cocoon O . O",Diaper Champ.txt,Diaper Champ[+3][u],['Diaper Champ']
217,And O it O is O very O easy O to O clean B-aspect . O,Diaper Champ.txt,clean[+3],['clean']
218,"I O can O keep O one O hand O on O my O baby O and O dump O the O diaper B-aspect at O the O same O time O , O it O is O that O simple O . O",Diaper Champ.txt,diaper[+3],['diaper']
219,I O am O SO O thankful O I O got O that O advice O when O I O did O because O I O had O the O Diaper O Genie O on O my O registry O aforementioned O to O her O warning O . O,Diaper Champ.txt,,[]
220,I O 'd O abhor O having O to O drive O all O the O way O to O a O baby O superstore O to O purchase O bags O her O dirty O diapers O are O just O going O to O get O thrown O away O in O . O,Diaper Champ.txt,,[]
221,I O am O very O pleased O with O our O choice O . O,Diaper Champ.txt,,[]
222,This O is O a O great O diaper B-aspect pail I-aspect . O,Diaper Champ.txt,diaper pail[+3],['diaper pail']
223,There O is O no O odor O and O it O is O very O easy O to O use B-aspect . O,Diaper Champ.txt,use[+3],['use']
224,"You O can O do O it O one O handed O while O still O hanging O on O to O the O baby O . O Also O , O we O like O using O regular O trash O bags O instead O of O having O to O worry O about O buying O refills B-aspect like O with O the O Diaper O Genie O . O",Diaper Champ.txt,refills[+3],['refills']
225,And O it O 's O the O largest O diaper B-aspect pail I-aspect I O 've O seen O without O taking O up O more O floor O space B-aspect . O,Diaper Champ.txt,"diaper pail[+3],space[+2]","['diaper pail', 'space']"
226,We O have O both O a O Diaper O Champ O and O a O Diaper O Genie O . O,Diaper Champ.txt,,[]
227,and O we O definitely O prefer O our O Champ B-aspect ! O,Diaper Champ.txt,Champ[+3][cc],['Champ']
228,"Not O only O is O it O much O more O cost B-aspect effective I-aspect you O can O use B-aspect regular O trash O bags O rather O than O Refills O at O $ O 5 O a O pop O , O it O is O easier O to O use B-aspect and O clean O , O and O has O a O larger O capacity B-aspect . O",Diaper Champ.txt,"cost effective[+3],use[+3],capacity[+3][cs]","['cost effective', 'use', 'capacity']"
229,Only O problem O . O,Diaper Champ.txt,,[]
230,it O can O be O frustrating O and O messy O when O you O put O that O last O diaper O in O before O realizing O the O unit B-aspect is O full O . O,Diaper Champ.txt,unit[-2],['unit']
231,The O pluger B-aspect gets O stuck O & O you O have O to O manually O extract O the O mess O . O,Diaper Champ.txt,pluger[-2],['pluger']
232,"I O registered O for O this O item B-aspect because O of O the O good O reviews O it O got O , O however O I O was O not O impressed O . O",Diaper Champ.txt,item[-1],['item']
233,"For O one O thing O , O The O diapers B-aspect always O get O jammed O in O it O . O",Diaper Champ.txt,diapers[-2],['diapers']
234,The O product B-aspect also O leaves O a O faint O smell O in O the O room O . O,Diaper Champ.txt,product[-2],['product']
235,"All O in O all O , O the O Diaper B-aspect Champ I-aspect serves O its O purpose O , O but O it O does O not O live O up O to O its O good O reviews O . O",Diaper Champ.txt,Diaper Champ[-1],['Diaper Champ']
236,I O got O the O diaper B-aspect champ I-aspect because O of O the O great O reviews O as O well O as O the O fact O that O you O can O use O regular O garbage O bags O . O,Diaper Champ.txt,diaper champ[+1],['diaper champ']
237,It O works B-aspect great O . O,Diaper Champ.txt,works[+3],['works']
238,"I O ca O n't O smell B-aspect anything O and O believe O me O , O this O is O quite O something O with O my O baby O . O",Diaper Champ.txt,smell[+3],['smell']
239,I O ended O up O buying O one O for O upstairs O and O one O for O downstairs O because O it O works B-aspect so O well O and O because O I O change O him O so O often O downstairs O . O,Diaper Champ.txt,works[+2],['works']
240,It O 's O much O better O than O putting O diapers O in O a O downstairs O trashcan O . O,Diaper Champ.txt,,[]
241,The O reviews O were O definitely O right O . O,Diaper Champ.txt,,[]
242,We O have O been O using O our O Diaper B-aspect Champ I-aspect for O almost O 14 O months O now O and O we O are O very O happy O with O it O . O,Diaper Champ.txt,Diaper Champ[+2],['Diaper Champ']
243,"It O sits O in O the O corner O of O our O bathroom O and O we O have O never O had O any O problems O with O odors B-aspect at O all O and O we O live O in O the O damp O and O humid O South O , O where O odors B-aspect of O all O kinds O are O generally O rife O . O",Diaper Champ.txt,odors[+2],['odors']
244,"It O is O easy O to O install B-aspect and O change B-aspect the O ordinary O trash O bags O , O easy O to O clean B-aspect , O and O most O important O , O easy O to O use B-aspect one O handed O - O just O insert O folded O dirty O diaper O and O flip O the O handle O . O",Diaper Champ.txt,"install[+2],change[+1],clean[+2],use[+3]","['install', 'change', 'clean', 'use']"
245,"As O the O bag O fills O , O you O may O need O to O flip O twice O to O ensure O that O the O weighted O cylinder O has O completely O pushed O the O diaper O into O the O bag O . O",Diaper Champ.txt,,[]
246,"For O the O first O 9 O months O or O so O , O we O only O needed O to O empty O this O once O a O week O . O",Diaper Champ.txt,,[]
247,"Now O that O our O son O 's O diapers O are O a O little O larger O , O they O take O up O more O space O , O and O we O empty O twice O a O week O . O",Diaper Champ.txt,,[]
248,We O have O never O had O any O problems O with O anything O like O loose O wipes B-aspect getting O stuck O we O always O wrap O them O in O the O dirty O diaper O . O,Diaper Champ.txt,wipes[+1],['wipes']
249,"It O is O a O bit O difficult O to O get O the O unit O open B-aspect the O advice O to O take O it O slowly O is O sound O , O but O now O that O our O son O is O walking O and O exploring O , O I O consider O this O a O positive O attribute O ! O",Diaper Champ.txt,open[+1],['open']
250,"Update O March O 2005 O : O My O son O has O been O out O of O diapers O for O almost O 2 O years O now O , O but O the O Diaper O Champ O hung O in O there O till O the O very O end O - O easy O to O use B-aspect , O no O problems O with O odors B-aspect , O and O one O of O the O best O bargains O among O all O of O the O paraphernalia O required O for O the O modern O baby O : O - O",Diaper Champ.txt,"use[+2],odors[+2],bargins[+2]","['use', 'odors', 'bargins']"
251,I O originally O put O this O item O on O my O baby O registry O because O friends O of O mine O highly O recommended O the O use O of O a O diaper O pail O . O,Diaper Champ.txt,,[]
252,"I O decided O to O go O with O the O Diaper B-aspect Champ I-aspect rather O than O the O more O popular O Diaper O Genie O , O because O I O did O n't O like O the O idea O of O having O to O buy O special O bags O . O",Diaper Champ.txt,Diaper Champ[+2][cc],['Diaper Champ']
253,Too O costly B-aspect and O not O efficient O if O you O ask O me O ! O,Diaper Champ.txt,costly[-2][u][cc],['costly']
254,THIS O PRODUCT B-aspect IS O A O LIFESAVER O ! O ! O,Diaper Champ.txt,PRODUCT[+3],['PRODUCT']
255,I O HAVE O NEVER O HAD O AN O ODOR B-aspect PROBLEM O ! O,Diaper Champ.txt,ODOR[+3],['ODOR']
256,No O one O has O ever O come O to O my O house O and O noticed O 'diaper O odor B-aspect . O ' O,Diaper Champ.txt,odor[+2],['odor']
257,"In O fact O , O people O who O have O been O present O while O I O changed O my O almost O 3 O month O old O son O 's O diaper O have O been O amazed O at O how O the O very O 'potent O ' O smell O of O the O dirty O diaper O seems O to O disappear O once O I O dispose O of O the O diaper O in O the O Diaper B-aspect Champ I-aspect . O",Diaper Champ.txt,Diaper Champ[+2],['Diaper Champ']
258,"For O those O who O are O experiencing O odor O problems O , O here O are O some O suggestions O which O should O solve O the O problem O : O",Diaper Champ.txt,,[]
259,1 O . O CHANGE O BAGS O FREQUENTLY O ! O ! O,Diaper Champ.txt,,[]
260,I O change O mine O about O 1 O or O 2 O times O a O week O . O,Diaper Champ.txt,,[]
261,"For O those O who O complain O that O the O pail O gets O stuck O , O that O is O probably O a O good O indication O that O the O BAG O IS O GETTING O TOO O FULL O ! O ! O",Diaper Champ.txt,,[]
262,"Also O , O making O sure O that O the O tape O on O the O diapers O is O secure O will O prevent O that O from O happening O as O well O . O",Diaper Champ.txt,,[]
263,2 O . O YOU O STILL O HAVE O TO O CLEAN B-aspect THE O THING O ! O ! O,Diaper Champ.txt,CLEAN[-1],['CLEAN']
264,"Hello O , O it O does O house O dirty O diapers O ! O ! O",Diaper Champ.txt,,[]
265,All O I O do O is O wipe O it O down O with O some O antibacterial O wipes O takes O about O 10 O seconds O ! O ! O and O then O maybe O spray O some O Lysol O in O it O and O let O it O air O out O for O a O minute O or O two O . O,Diaper Champ.txt,,[]
266,SIMPLE O AND O IT O WORKS B-aspect ! O,Diaper Champ.txt,WORKS[+2],['WORKS']
267,"Also O , O for O those O that O complain O that O the O Diaper B-aspect Champ I-aspect is O n't O as O effective O as O time O passes O , O keep O the O following O in O mind O : O AS O BABIES O GET O OLDER O , O THEIR O DIETS O CHANGES O aka O SOLID O FOODS O ! O AND O SO O DOES O THE O SMELL O OF O THEIR O DIAPERS O ! O",Diaper Champ.txt,Diaper Champ[-1],['Diaper Champ']
268,"In O talking O with O other O parents O , O I O get O the O same O feedback O - O as O babies O get O older O and O become O toddlers O , O ALL O DIAPER O PAILS O become O gradually O less O and O less O effective O until O they O are O just O no O longer O useful O . O",Diaper Champ.txt,,[]
269,"Again O , O this O is O because O as O their O diet O changes O , O so O does O the O consistency O and O odor O of O their O stool O , O in O other O words O , O it O gets O stinkier O ! O ! O ! O",Diaper Champ.txt,,[]
270,"All O in O all O , O this O product B-aspect is O definitely O one O I O would O recommend O and O certainly O worth O the O very O reasonable O price B-aspect . O",Diaper Champ.txt,"product[+2],price[+2]","['product', 'price']"
271,"I O love O the O diaper B-aspect champ I-aspect , O it O is O really O easy O to O use B-aspect and O since O you O can O use B-aspect regular O garbage O bags O it O does O n't O cost O an O arm O and O a O leg O for O refills B-aspect . O",Diaper Champ.txt,"diaper champ[+3],use[+2],refills[+1]","['diaper champ', 'use', 'refills']"
272,The O only O downside O to O this O is O that O it O can O get O pretty O stinky O long O before O the O pail B-aspect is O full O . O,Diaper Champ.txt,pail[-2],['pail']
273,"I O wash O ours O out O with O lysol O each O time O I O empty O it O , O and O that O helps O , O but O when O its O hot O out- O well O , O just O be O prepared O . O",Diaper Champ.txt,pail[-2],['pail']
274,"We O used O this O diaper O pail O from O the O day O we O brought O our O son O home O , O until O about O 13 O months O . O",Diaper Champ.txt,,[]
275,"That O 's O when O it O went O from O Oderless O , O to O ODEROUS B-aspect ! O",Diaper Champ.txt,ODEROUS[-3],['ODEROUS']
276,Even O when O empty O ! O,Diaper Champ.txt,,[]
277,"So O , O I O took O it O to O the O tub O , O scrub O it O down O with O disinfectant O . O",Diaper Champ.txt,,[]
278,It O still O smelled O . O,Diaper Champ.txt,semelled[-2],['semelled']
279,So O then O I O used O straight O bleach O . O,Diaper Champ.txt,,[]
280,That O seemed O to O work O -- O for O about O 3 O days O . O,Diaper Champ.txt,,[]
281,Then O it O started O to O smell B-aspect whether O there O were O diapers O in O it O or O not O . O,Diaper Champ.txt,smell[-2],['smell']
282,"However O , O for O the O previous O 13 O months-this O is O what O I O encountered O - O PROS O - O",Diaper Champ.txt,,[]
283,Using O your O own O bags B-aspect is O much O cheaper O and O convenient O . O,Diaper Champ.txt,bags[+2],['bags']
284,"The O height B-aspect is O a O more O convenient O reach O than O others O , O where O you O have O to O hunch O over O . O",Diaper Champ.txt,height[+2],['height']
285,"Its O stable B-aspect , O so O a O curious O toddler O ca O n't O easily O tip O it O over O . O",Diaper Champ.txt,stable[+2],['stable']
286,CONS O - O Difficult O to O open B-aspect to O change O bag-twice O my O bags O caught O on O a O sharp O edge O inside O and O snagged O as O I O was O pulling O out-leaving O dirty O diapers O all O over O the O floor O . O,Diaper Champ.txt,open[-2],['open']
287,"Also O , O diapers B-aspect tend O to O stay O in O the O middle O , O causing O the O pail O to O get O backed O up O . O",Diaper Champ.txt,diapers[-2],['diapers']
288,Diapers B-aspect can O get O stuck O when O turned O around O if O you O do O n't O tightly O wrap O them O first O . O,Diaper Champ.txt,Diapers[-2],['Diapers']
289,My O toddler O thought O rotating O the O top O was O fun-he O always O wanted O to O play O with O it O,Diaper Champ.txt,,[]
290,"Being O a O diaper O pail O , O I O 'd O prefer O he O not O be O enticed O by O something O so O unsanitary O . O",Diaper Champ.txt,,[]
291,I O wanted O this O product B-aspect because O i O did O n't O have O to O buy O special O bags O for O it O and O it O also O came O highly O recommended O . O,Diaper Champ.txt,product[+2],['product']
292,The O only O problem O i O have O is O with O the O handle O you O use O to O open B-aspect the O top O compartment O . O,Diaper Champ.txt,open[-1],['open']
293,The O way O you O have O to O shove O your O fingers O under O it O and O pull B-aspect is O just O too O tight O . O,Diaper Champ.txt,pull[-1],['pull']
294,I O ca O n't O tell O you O how O many O times O i O 've O chipped O a O nail O or O hurt O my O fingertips O because O of O the O force O needed O to O open B-aspect it O . O,Diaper Champ.txt,open[-2],['open']
295,That O would O be O my O only O complaint O . O,Diaper Champ.txt,,[]
296,This O is O a O GREAT O product B-aspect ! O,Diaper Champ.txt,product[+3],['product']
297,I O had O never O liked O the O idea O of O the O Diaper O Genie O because O of O the O refills O . O,Diaper Champ.txt,Diapers[-1][cc],['Diapers']
298,"Not O only O can O they O be O a O pain O to O install O , O but O who O needs O one O extra O thing O to O watch O a O supply O of O ? O",Diaper Champ.txt,,[]
299,"I O mean O , O with O babies O it O 's O already O far O too O easy O to O run O out O of O diapers O or O formula O . O",Diaper Champ.txt,,[]
300,"I O could O n't O picture O myself O yelling O to O hubby O , O `` O Honey O , O I O know O you O have O sixty O other O things O to O get O ... O can O you O also O pick O up O refills O for O the O diaper O pail O ? O '' O",Diaper Champ.txt,,[]
301,The O Champ O works B-aspect great O . O,Diaper Champ.txt,works[+2],['works']
