,text,dataset,aspect_str,aspects
302,We O use O regular O kitchen O sized O garbage B-aspect bags I-aspect . O,Diaper Champ.txt,garbage bags[+1],['garbage bags']
303,We O 've O never O experienced O odor B-aspect from O the O pail O . O,Diaper Champ.txt,odor[+2],['odor']
304,"It O was O easy O to O assemble B-aspect , O and O the O diapers O fit B-aspect perfectly O into O the O little O nook O before O they O make O their O way O into O the O pail O portion O . O",Diaper Champ.txt,"assemble[+2], fit[+2]","['assemble', 'fit']"
305,I O also O love O that O you O can O flip O the O device O with O one O hand O ... O,Diaper Champ.txt,filp[+2],['filp']
306,Highly O recommended O ! O ! O ! O,Diaper Champ.txt,,[]
307,"Makes O life O easier O and O keeps O baby O 's O room O smelling O like O baby O , O not O dirty O diapers O ! O",Diaper Champ.txt,,[]
308,Excellent O diaper O disposal O unit B-aspect . O,Diaper Champ.txt,unit[+3],['unit']
309,I O used O it O in O conjunction O with O Glad O 3ply O kitchen O trash O bags O with O odor O control O scented O . O,Diaper Champ.txt,,[]
310,I O am O soooo O pleased O with O this O product B-aspect ! O ! O ! O,Diaper Champ.txt,product[+3],['product']
311,A O wise O investment B-aspect for O the O pocketbook O & O for O the O nose O ! O ! O ! O,Diaper Champ.txt,investment[+2],['investment']
312,Diaper B-aspect Champ I-aspect is O great O . O,Diaper Champ.txt,Diaper Champ[+3],['Diaper Champ']
313,But O just O to O let O you O know O that O I O 've O been O breastfeeding O and O the O poop O does O n't O stink O as O much O as O formula O poop O . O,Diaper Champ.txt,,[]
314,"So O I O ca O n't O tell O you O if O Diaper B-aspect Champ I-aspect will O be O as O good O at O containing O the O formula O generated O poop O smell O , O but O it O 's O excellent O at O containing O the O smell O of O poop O of O my O breastfed O baby O ! O",Diaper Champ.txt,Diaper Champ[+3],['Diaper Champ']
315,"Friends O told O me O that O the O Diaper O Genie O did O not O work O very O well O , O so O bought O the O Diaper B-aspect Champ I-aspect based O on O on-line O reviews O and O I O have O been O happy O with O it O . O",Diaper Champ.txt,Diaper Champ[+2][cc],['Diaper Champ']
316,"It O works B-aspect easily O with O one O hand O , O which O is O important O . O",Diaper Champ.txt,works[+2],['works']
317,"Also O , O it O takes O any O kitchen O sized O trash B-aspect bag I-aspect , O so O there O is O no O special O bag O to O stock O . O",Diaper Champ.txt,trash bag[+2],['trash bag']
318,"While O the O perfect O ordor O free O diaper O pail O has O yet O to O be O invented O , O the O Diaper B-aspect Champ I-aspect is O a O good O as O it O gets O . O",Diaper Champ.txt,Diaper Champ[+2],['Diaper Champ']
319,"Gets O stinky O after O a O few O months O , O the O seal B-aspect on O the O piston O does O n't O seal B-aspect anymore O . O",Diaper Champ.txt,seal[-2],['seal']
320,"Also O , O diapers O and O wipes B-aspect get O stuck O in O the O grove O below O the O piston O . O",Diaper Champ.txt,wipes[-2],['wipes']
321,Large O diapers O have O to O be O wrapped O tightly O . O,Diaper Champ.txt,,[]
322,I O gave O up O and O got O a O diaper B-aspect Dekor I-aspect . O,Diaper Champ.txt,diaper Dekor[-1][cc],['diaper Dekor']
323,Much O more O hands O off O and O takes O any O size O diapers O . O,Diaper Champ.txt,,[]
324,Also O much O less O stinky B-aspect . O,Diaper Champ.txt,stinky[-1],['stinky']
325,Do O n't O buy O the O diaper B-aspect champ I-aspect . O,Diaper Champ.txt,diaper champ[-3],['diaper champ']
326,You O will O be O sorry O after O a O few O months O . O,Diaper Champ.txt,,[]
327,So O far O so O good O . O,Diaper Champ.txt,,[]
328,I O was O using O the O cheapie O pail B-aspect ... O and O it O worked B-aspect ok O until O the O opening O device O fell O apart O . O,Diaper Champ.txt,"pail[+1],worked[+2]","['pail', 'worked']"
329,I O am O wondering O how O some O of O these O reviewers O are O able O to O stand O having O kids O ? O,Diaper Champ.txt,,[]
330,"Even O the O old O pail O hardly O smelled O bad O to O me O , O I O think O after O you O have O changed O diapers O for O 4 O years O , O you O get O somewhat O immune O to O it O . O",Diaper Champ.txt,,[]
331,"I O could O probably O use O a O trash O can O and O be O ok O at O this O point O , O but O this O prduct O seems O to O work O very O well O so O far O . O",Diaper Champ.txt,product[+2],['product']
332,Let O me O just O say O this O ... O After O being O a O nanny O for O almost O 10 O years O I O have O tried O them O all O . O,Diaper Champ.txt,,[]
333,This O one O is O really O great O . O,Diaper Champ.txt,pail.[+3],['pail.']
334,I O actually O took O a O friends O word O on O it O and O went O with O this O Champ B-aspect when O registering O and O I O am O glad O I O did O . O,Diaper Champ.txt,Champ[+2],['Champ']
335,"I O just O knew O all O along O what O products O I O would O not O use O , O but O was O undecided O on O the O actual O one O I O wanted O . O",Diaper Champ.txt,,[]
336,Well O the O Champ B-aspect has O survived O it O 's O first O year O with O our O son O and O it O is O great O ! O ! O,Diaper Champ.txt,Champ[+3],['Champ']
337,We O just O bought O another O for O baby O boy O number O two O coming O next O month O . O,Diaper Champ.txt,,[]
338,The O thought O of O not O having O to O buy O refills B-aspect and O just O using O regular O bags O is O awesome O ! O,Diaper Champ.txt,refills[+3],['refills']
339,We O just O buy O the O smaller O bags O that O come O like O 250 O to O a O roll O and O are O sented O and O they O are O like O $ O 6.00 O and O they O work B-aspect great O . O,Diaper Champ.txt,work[+2],['work']
340,We O just O recently O had O to O buy O another O roll O of O bags B-aspect . O SO O $ O 6.00 O for O a O year O of O bags- O ca O n't O beat O that O ! O ! O,Diaper Champ.txt,bags[+3],['bags']
341,We O lysol O the O champ O every O time O we O change B-aspect the O bag O out O and O have O not O had O any O problems O . O,Diaper Champ.txt,change[+2],['change']
342,Would O reccommend O to O anyone O and O everyone O ! O ! O,Diaper Champ.txt,,[]
343,Do O n't O listen O to O the O bad O reviews O ! O,Diaper Champ.txt,,[]
344,This O is O really O a O nice O diaper B-aspect pail I-aspect . O,Diaper Champ.txt,diaper pail[+2],['diaper pail']
345,I O recommend O it O to O both O parents O of O infants O and O toddlers O . O,Diaper Champ.txt,diaper pail[+2],['diaper pail']
346,"In O fact O , O I O liked O it O so O much O after O using O it O with O my O son O who O is O now O 2 O years O old O , O that O I O bought O one O for O our O new O baby O 's O room O . O",Diaper Champ.txt,diaper pail[+2],['diaper pail']
347,Originally O with O my O son O we O had O a O Diaper O Genie O . O,Diaper Champ.txt,,[]
348,Wow O - O was O that O disappointing O and O we O did O n't O even O have O it O 6 O months O before O it O broke O . O,Diaper Champ.txt,diaper pail[+1][cc][p],['diaper pail']
349,I O bought O the O Diaper B-aspect Champ I-aspect and O have O been O very O happy O for O the O following O reasons O . O,Diaper Champ.txt,Diaper Champ[+2],['Diaper Champ']
350,1 O . O The O Diaper O Champ O does O n't O require O special O refills B-aspect that O are O expensive O and O hard O to O find O ! O,Diaper Champ.txt,refills[+2],['refills']
351,We O just O use O the O Glad O tall O kitchen O trash O can O bags O with O odor O shield O from O Target O and O they O work B-aspect wonderfully O . O,Diaper Champ.txt,work[+2],['work']
352,We O do O n't O have O to O worry O about O running O out O of O refills B-aspect with O this O diaper O pail O ! O,Diaper Champ.txt,refills[+2],['refills']
353,2 O . O It O can O be O operated B-aspect with O one O hand O - O Leaving O a O hand O on O your O baby O on O the O changing O table O . O,Diaper Champ.txt,operated[+2],['operated']
354,So O much O safer B-aspect than O the O others O that O require O a O two O handed O operation O ! O,Diaper Champ.txt,safer[+2][cc],['safer']
355,"With O them O , O you O have O to O put O your O baby O on O the O floor O or O someplace O else O safe O just O to O put O the O diaper O in O the O pail O . O",Diaper Champ.txt,,[]
356,The O Diaper B-aspect Champ I-aspect is O so O simple O that O my O toddler O loves O to O put O his O own O diapers O in O the O Diaper B-aspect Champ I-aspect and O flip O over O the O handle O . O,Diaper Champ.txt,Diaper Champ[+2],['Diaper Champ']
357,He O thinks O it O is O magic O when O the O diaper O `` O disappears O '' O . O,Diaper Champ.txt,,[]
358,3 O . O Bags O are O easy O to O change B-aspect . O,Diaper Champ.txt,change[+2],['change']
359,"Pop O the O lid O , O fold O it O back O on O its O hinge O , O pull O the O trash O bag O through O the O ring O , O and O take O out O the O dirty O diapers O . O",Diaper Champ.txt,,[]
360,"To O replace O the O bag O simply O open O it O up O and O feed O the O top O of O the O bag O through O ring O , O fold O it O over O the O sides O of O the O ring O , O and O close O . O",Diaper Champ.txt,,[]
361,"It O takes O all O of O 2 O minutes O , O if O that O . O 4 O . O",Diaper Champ.txt,,[]
362,It O keeps O smells O out O of O your O nursery O or O toddler O room O ! O,Diaper Champ.txt,,[]
363,"Yes O , O you O may O get O a O whiff O of O a O smell B-aspect when O you O flip O the O handle O , O but O then O it O is O gone O . O",Diaper Champ.txt,smell[-1],['smell']
364,"Remember O , O it O does O hold O dirty O diapers O ! O",Diaper Champ.txt,,[]
365,To O eliminate O any O smells B-aspect we O simple O stuck O a O Stick O Up O room O deodorizer O inside O the O lid O . O,Diaper Champ.txt,smells[-1][s],['smells']
366,Now O when O you O flip O the O handle O you O get O the O Stick O Up O smell O instead O . O,Diaper Champ.txt,,[]
367,Works B-aspect great O ! O ! O ! O ! O,Diaper Champ.txt,Works[+3],['Works']
368,5 O . O The O price B-aspect is O right O . O,Diaper Champ.txt,price[+2],['price']
369,At O $ O 30 O we O put O one O in O the O nursery O and O one O in O our O toddler O 's O room O . O,Diaper Champ.txt,,[]
