,text,dataset,aspect_str,aspects
155,You O must O buy O some O sort O of O protective O case O unless O you O want O your O ipod O to O look O like O some O crazed O animal O with O ten O inch O nails O attacked O it O . O,ipod.txt,,[]
156,The O Battery B-aspect does O not O last O 12 O hours O . O,ipod.txt,Battery[-1],['Battery']
157,"Like O I O said O , O I O 've O had O my O ipod O for O six O short O months O and O I O 'd O estimate O the O battery O life O to O be O about O four O hours O at O the O most O . O",ipod.txt,,[]
158,It O seems O to O deteriorate O every O time O I O use O it O . O,ipod.txt,,[]
159,"You O ca O n't O change O the O battery B-aspect , O so O I O do O n't O know O what O I O 'm O going O to O do O in O a O year O or O so O . O",ipod.txt,battery[-2],['battery']
160,"* O You O ca O n't O turn O the O volume B-aspect up O very O high O , O but O I O think O this O might O be O for O health O reasons O . O * O",ipod.txt,volume[-1],['volume']
161,"My O ipod O freezes B-aspect occasionally O , O which O is O especially O annoying O when O you O 're O in O the O middle O of O a O game O of O `` O brick O . O '' O * O",ipod.txt,freezes[-1],['freezes']
162,"If O you O call O apple B-aspect and O tell O them O your O ipod O has O been O damaged O , O they O charge O you O roughly O $ O 105.50 O per O minute O and O blame O you O for O `` O abusing O '' O your O ipod O . O",ipod.txt,apple[-2],['apple']
163,The O user O support B-aspect service I-aspect is O n't O too O great O either O . O,ipod.txt,support service[-2],['support service']
164,Buyer O beware O ! O,ipod.txt,,[]
165,Everything O I O Wanted O ! O The O Apple O iPod B-aspect has O become O one O of O the O most O sought-after O electronic O gadgets O - O and O for O good O reason O . O,ipod.txt,iPod[+2],['iPod']
166,"Its O sleek O design B-aspect , O large O memory O capacity B-aspect , O compatibility O with O iTunes B-aspect , O and O ease O of O use O makes O this O one O of O the O best O portable O digital O listening O devices O on O the O market O . O",ipod.txt,"design[+2],capacity[+2],iTunes[+2]","['design', 'capacity', 'iTunes']"
167,"Unless O you O have O an O enormous O music/audio O book O library O , O the O 20 O GB O model O should O have O more O than O adequate O storage O capacity B-aspect , O with O a O stated O ability O to O hold O 5000 O songs O . O",ipod.txt,capacity[+2],['capacity']
168,"At O an O average O of O 14 O cuts O per O CD O , O that O 's O over O 350 O CD O 's O . O",ipod.txt,,[]
169,"This O version O does O not O come O with O a O dock O , O although O it O can O be O added O later O as O an O accessory O . O Y O",ipod.txt,,[]
170,"You O can O use O it O to O listen O to O music O or O audio O books O , O either O downloaded O via O the O internet O or O added O to O your O music O library O using O your O CD O drive O . O",ipod.txt,,[]
171,"Features O : O click O wheel B-aspect to O navigate O ; O ability O to O work O with O Windows O or O Mac O ; O optional O backlighting B-aspect you O can O have O it O on O all O the O time O , O or O have O it O shut O off O to O save O battery O power O after O 5 O , O 10 O , O or O 20 O seconds O ; O ability O to O download O PDA O info O ; O automatic O or O manual O download O from O iTunes B-aspect when O iPod O is O plugged O into O your O computer O . O",ipod.txt,"wheel[+2], backlighting[+2],iTunes[+2]","['wheel', 'backlighting', 'iTunes']"
172,"There O 's O even O an O equalizer B-aspect under O `` O settings O '' O that O allows O you O to O adjust O the O sound O for O acoustic O , O bass O booster O , O bass O reducer O , O classical O , O dance O , O `` O deep O '' O , O and O electronic O . O",ipod.txt,equalizer[+2],['equalizer']
173,"With O accessories B-aspect , O you O can O make O the O iPod O into O a O digital O recorder O , O broadcast O it O remotely O through O stereo O speakers O using O wireless O technology O , O and O play O it O through O your O car O speakers O using O either O a O CD O adaptor O or O FM O stereo O broadcaster O . O",ipod.txt,accessories[+1],['accessories']
174,"The O iPod O comes O formatted O for O the O Mac O , O but O within O seconds O of O plugging O it O into O a O PC O , O is O automatically O reformatted B-aspect for O Windows O . O The O HP O version O comes O with O Windows O formatting O , O and O takes O seconds O to O change O to O Mac O . O Although O the O iPod O can O be O changed O from O one O format O to O another O , O you O will O lose O all O of O your O music O and O data O when O doing O so O . O",ipod.txt,reformatted[-2],['reformatted']
175,Both O platforms O work O seamlessly O with O the O iPod O . O,ipod.txt,,[]
176,"The O box O comes O with O iPod O , O ear O buds O , O iTunes O and O iPod O software O , O USB O 2.0 O and O FireWire O cables O , O and O a O home O charger O . O",ipod.txt,,[]
177,You O will O need O a O computer O with O a O six-pin O FireWire O or O USB O 2.0 O port O USB O 1.1 O,ipod.txt,,[]
178,"For O Mac O owners O , O you O 'll O need O Mac O OS O X O 10.1.5 O or O later O 10.3.4 O or O later O is O recommended O and O your O machine O must O have O the O appropriate O ports O built-in O . O",ipod.txt,,[]
179,"PC O users O must O have O a O processor O of O 500 O MHZ O or O faster O , O Windows O 2000 O with O Service O Pack O 4 O or O later O or O Windows O XP O , O with O the O ports O either O built-in O or O expanded O with O a O card O . O",ipod.txt,,[]
180,ITunes B-aspect can O be O downloaded O from O the O enclosed O CD O or O for O free O from O the O Apple O site O . O,ipod.txt,ITunes[+2],['ITunes']
181,"Since O nothing O is O perfect O , O the O iPod O does O have O some O disadvantages O , O such O as O its O reliance O on O iTunes O to O download O music O if O you O hate O iTunes O , O do O n't O buy O an O iPod O ! O . O",ipod.txt,,[]
182,"Because O it O is O a O hard O drive O , O it O has O moving O parts O unlike O other O MP3 O players O , O perhaps O making O it O more O prone O to O catastrophic O damage O . O",ipod.txt,,[]
183,"Its O steel B-aspect backing I-aspect picks O up O fingerprints O and O scratches O easily O , O not O great O from O a O cosmetic O standpoint O . O",ipod.txt,steel backing[-2],['steel backing']
184,"All O in O all O , O this O is O a O wonderful O device B-aspect . O",ipod.txt,device[+2][p],['device']
185,"About O 1/2 O inch O thick O , O with O the O face O dimensions O the O size O of O a O credit O card O , O it O can O be O slipped O in O a O pocket O or O carried O easily O in O the O han O ! O d O . O",ipod.txt,,[]
186,"The O weight B-aspect is O heavier O than O many O digital O players O , O but O I O like O the O solid B-aspect feel I-aspect . O",ipod.txt,"weight[-1],solid feel[+2]","['weight', 'solid feel']"
187,Highly O recommended O for O people O who O like O to O listen O to O music O or O audio O books O on O the O go O . O,ipod.txt,,[]
188,Holy O cow O ! O It O really O does O scratch B-aspect easily O ! O,ipod.txt,scratch[-2],['scratch']
189,Wow O ... O just O less O than O 15 O minutes O and O the O back O of O it O already O has O a O scratch O ! O,ipod.txt,,[]
190,"So O dissapointing O , O however O I O am O now O just O gon O na O assume O it O 's O gon O na O get O pretty O niceley O scratched O over O the O years O and O I O 'll O just O have O to O live O with O it O ... O and O i O will O buy O a O case O for O it O tomorrow O ... O I O mean O heck O I O intended O to O get O the O case O tomorow O anyway O but O now O it O feels O like O the O thing O might O even O scratch O IN O THE O CASE.. O Other O than O that O I O am O super O extied O about O this O product O ... O I O will O update O the O review O later O in O a O few O days O ... O",ipod.txt,,[]
191,great O product O with O Limited O Services O,ipod.txt,,[]
192,I O was O quite O happy O after O months O of O saving O part O of O my O pay-check O to O go O to O the O store O and O finally O get O an O iPod O . O,ipod.txt,,[]
193,"It O was O worth O it O , O as O I O use O it O to O this O very O day O . O",ipod.txt,,[]
194,"The O thing O has O survived O plenty O of O falls O with O little O or O no O damage O , O except O the O inevitable O scratches B-aspect . O",ipod.txt,scratches[-2],['scratches']
195,"Apple B-aspect has O definately O fulfilled O its O reputation O in O making O quality O equipment O , O and O surprisingly O was O n't O as O expensive O as O its O reputation O normally O holds O . O",ipod.txt,Apple[+2],['Apple']
196,"However O , O it O fell O into O one O of O Apple O 's O worst O reputations O . O",ipod.txt,,[]
197,"It O is O very O closed O to O services O and O programs O outside O of O Apple O 's O small O though O luxiourious O , O admittedly O island O . O",ipod.txt,,[]
198,"However O , O they O close O you O off O from O exploring O the O continent O that O is O other O music O providers O . O",ipod.txt,,[]
199,"After O hearing O about O the O new O Napster O service O for O portable O MP3 O players O , O I O was O anxious O to O try O it O out O . O",ipod.txt,,[]
200,This O type O of O service O is O one O that O Microsoft O is O touting O ... O one O where O you O pay O a O flat O rate O per O month O for O unlimited O music O downloads O . O,ipod.txt,,[]
201,So O it O was O not O any O surprise O that O I O could O not O try O out O this O new O type O of O service O . O,ipod.txt,,[]
202,"Apple B-aspect closed O their O island O to O anything O that O resembled O Microsoft O , O and O clearly O let O Napster O know O it O could O not O use O their O products O with O Napster O 's O services O . O",ipod.txt,Apple[-2],['Apple']
203,This O has O been O the O case O with O all O other O competing O music O services O and O Napster O . O,ipod.txt,,[]
204,Why O would O they O let O anything O compete O with O them O when O they O are O making O millions O from O song O downloads O by O iPod O owners O who O have O no O other O choice O ? O,ipod.txt,,[]
205,"If O Apple O makes O no O attempt O to O at O least O create O an O equivalent O type O of O service O , O they O are O failing O to O compete O with O the O market O . O",ipod.txt,,[]
206,"And O if O they O treat O their O customers O like O herding O sheep O , O I O see O little O reason O to O purchase O another O MP3 O player O with O a O bitten O apple O embroidered O on O it O . O",ipod.txt,,[]
207,Battery B-aspect non-issue O . O,ipod.txt,Battery[+2],['Battery']
208,The O iPod O batteries O can O go O through O a O full O recharge O cycle O 400 O times O . O,ipod.txt,,[]
209,If O you O listen O to O the O iPod O four O hours O per O day O and O you O get O 10 O hours O per O recharge O cycle O not O the O full O twelve O specified O by O Apple O then O the O iPod O will O give O you O over O 2.5 O years O of O daily O listening O . O,ipod.txt,,[]
210,Apple O provides O a O good O discussion O of O the O battery O technology O at O www.apple.com/batteries O and O this O web O address O is O noted O in O the O iPod O manual O,ipod.txt,,[]
211,"My O earlier O generation O 15Gb O iPod O lasted O two O years O , O shortened O by O my O own O inattention O to O the O simple O maintainence O asked O by O Apple O go O through O at O least O one O charging O cycle O per O month O , O and O do O n't O store O the O iPod O in O a O car O on O a O summer O day O because O high O temp O . O is O harmful O to O the O battery O 's O life O . O",ipod.txt,,[]
212,"Finally O , O if O your O battery O gives O out O , O you O can O use O any O number O of O reputable O iPod O services O to O swap O it O out O for O < O $ O 50 O and O you O 're O good O to O go O for O another O 2.5 O years O or O longer O if O battery O technology O improves O . O",ipod.txt,,[]
213,Ask O yourself O how O often O you O 've O seen O battery O covers O break O on O consumer O electronics O . O,ipod.txt,,[]
214,They O wear O out O pretty O easily O when O you O 're O changing O batteries O every O week O or O so O . O,ipod.txt,,[]
215,"Given O that O , O I O find O the O iPod O solution O reasonable O : O keep O the O case O sealed O and O let O the O battery O be O changed O by O a O technician O once O every O 2-3 O years O . O",ipod.txt,,[]
216,No O big O deal O . O,ipod.txt,,[]
217,You O might O change O the O battery O once O before O the O iPod O is O superceded O by O something O a O lot O better O and O less O expensive O . O,ipod.txt,,[]
218,In O fact O you O may O get O a O newer-better-cheaper O device O before O you O get O to O that O point O . O,ipod.txt,,[]
219,"Finally O , O compare O the O iPod B-aspect to O other O players O on O a O cost/Gb O , O and O also O consider O ease O of O use B-aspect . O",ipod.txt,"iPod[+2],use[+2]","['iPod', 'use']"
220,The O iPod B-aspect is O not O overpriced O compared O to O the O market O . O,ipod.txt,iPod[+2],['iPod']
221,This O is O the O best O purchase B-aspect I O 've O made O in O a O very O long O time O . O,ipod.txt,purchase[+2],['purchase']
222,I O am O a O total O iPod O addict O . O,ipod.txt,,[]
223,"The O sound B-aspect is O INCREDIBLE O ; O very O clean O , O very O wide O dynamic O range O of O bass B-aspect , O mids O and O highs O , O and O can O be O very O loud O if O I O turn O it O up O full O blast O . O",ipod.txt,"sound[+3],bass[+3]","['sound', 'bass']"
224,"I O have O less O than O 3 O GB O worth O of O music O , O and O I O do O n't O have O any O more O music O in O my O collection O . O",ipod.txt,,[]
225,I O love O my O new O iPod O ! O,ipod.txt,,[]
226,The O Great O And O Versatile B-aspect iPod O I O love O my O iPod O ! O,ipod.txt,Versatile[+2],['Versatile']
227,"I O have O wanted O one O for O a O long O time O , O but O just O did O n't O want O to O spend O the O money O . O",ipod.txt,,[]
228,I O wish O I O had O a O long O time O ago O . O,ipod.txt,,[]
229,"The O sound B-aspect quality O is O excellent O , O accessing O the O music O is O easy O , O and O the O controls B-aspect are O generally O well O thought O out O . O",ipod.txt,"sound[+3],controls[+2]","['sound', 'controls']"
230,"As O a O Windows O user O , O I O had O to O install O the O software O including O drivers O and O iTunes B-aspect on O my O desktop O , O and O this O is O the O only O area O where O I O encountered O a O nuisance O . O",ipod.txt,iTunes[-1],['iTunes']
231,The O first O install O did O not O work O correctly O and O would O never O transfer O music O to O the O iPod O but O did O allow O me O to O register O with O Apple O and O load O songs O into O iTunes O . O,ipod.txt,,[]
232,"Eventually O I O had O to O uninstall O the O whole O works O and O reinstall O it O from O scratch O , O and O from O then O on O it O has O worked O like O a O dream O . O",ipod.txt,,[]
233,"I O still O give O the O iPod B-aspect five O stars O , O though O , O as O it O could O have O been O something O I O did O incorrectly O during O the O install O though O I O did O follow O the O onscreen O prompts O so O I O 'll O give O Apple O the O benefit O of O the O doubt O . O",ipod.txt,iPod[+3],['iPod']
234,"My O only O regret O is O that O I O bought O the O 20GB O model O , O which O is O way O too O big O for O what O I O really O need O : O I O would O have O been O better O off O with O a O smaller O model O of O lower O capacity O . O",ipod.txt,,[]
235,"Perhaps O over O time O I O will O fill O it O up O , O but O with O almost O 250 O songs O on O my O iPod O now O and O less O than O 1GB O used O , O I O have O a O long O way O to O go O . O",ipod.txt,,[]
236,That O 's O the O only O advice O I O would O give O to O someone O considering O an O iPod O purchase O : O you O really O may O not O really O need O 20GB O or O 40GB O . O,ipod.txt,,[]
237,"The O iPod O does O come O with O other O nifty O software O accoutrements O , O but O honestly O I O have O n't O used O them O much O as O I O use O the O iPod O to O listen O to O music O while O I O run O or O on O a O plane O . O",ipod.txt,,[]
238,The O battery B-aspect holds O a O charge O for O a O very O long O time O maybe O 15 O or O so O hours O of O use O so O realistically O there O are O no O real O range O or O endurance O issues O associated O with O iPod O use O . O,ipod.txt,battery[+1],['battery']
239,"My O only O complaint O really O more O of O an O observation O is O that O the O outside B-aspect finish I-aspect of O the O iPod O is O rather O delicate O , O so O I O am O going O to O get O a O case O for O mine O so O it O does O n't O get O all O scratched O up O . O",ipod.txt,outside finish[-2],['outside finish']
240,"It O sure O does O look O nice O , O though O ! O I O recommend O this O to O any O music O lover O anywhere O : O the O quality O of O the O audio O is O excellent O , O the O controls B-aspect and O indicators O rapidly O become O intuitive O , O and O the O storage O capacity B-aspect and O battery O life O are O huge O ! O",ipod.txt,"quality of audio[+2],controls[+2],capacity[+2]","['quality of audio', 'controls', 'capacity']"
241,Still O my O favorite O MP3 O player O Is O it O overpriced O ? O,ipod.txt,,[]
242,"Dunno O , O possibly O but O you O have O to O ask O yourself O what O you O are O neccessarily O paying O for O , O which O is O 20GBs O worth O of O storage O capacity O , O which O even O if O all O your O music O is O in O high O fidelity O such O as O 320kpbs O , O there O is O still O a O whole O lot O of O room O to O place O much O music O in O here O . O",ipod.txt,,[]
243,"Using O the O software O iTunes B-aspect is O relatively O simple O , O you O just O plug O the O USB O cable O in O , O wait O your O machine O to O detect O the O iPod O and O voila O , O any O songs O listed O in O your O iTunes B-aspect library O will O be O transfered O on O over O to O the O iPod O . O",ipod.txt,iTunes[+2],['iTunes']
244,At O first O I O primarily O used O it O as O a O stand-alone O portable O player O but O it O was O n't O until O I O decided O to O take O it O in O my O car O and O use O it O to O play O back O music O that O I O truly O adored O this O device O . O,ipod.txt,,[]
245,"Now O if O you O do O decide O to O take O the O iPod O on O the O road O , O my O suggestion O is O to O forego O any O purchasing O of O the O FM O Transmitter O devices O , O unless O you O live O out O in O the O middle O of O Mississipi O because O frankly O , O you O 'll O need O a O next-clear O FM O channel O on O your O radio O to O get O any O sembelance O of O a O clear O signal O . O",ipod.txt,,[]
246,"I O actually O hooked O up O the O iPod O to O my O receivers O AUX O port O with O a O Pbus O connector O and O a O Y-splitter O cable O , O it O was O n't O too O hard O to O do O and O now O , O I O can O listen O to O all O my O music O in O my O car O without O ever O having O to O lug O around O CDs O again O . O",ipod.txt,,[]
247,"And O , O with O the O iPods O ' O full O volume O up O , O all O you O have O to O do O is O adjust O your O receivers O ' O volume O and O your O set O , O since O the O iPod O itself O acts O as O a O strong O amplifer O of O its O ' O own O . O",ipod.txt,amplifier[+2],['amplifier']
248,"If O there O were O any O complaints O I O have O , O they O are O marginal O , O but O one O is O Apples O ' O properietary O set-up O for O music O files O , O their O incompatibility O with O other O music O services O i.e O . O Napster O is O down O right O wrong O . O",ipod.txt,proprietary[-1],['proprietary']
249,"I O mean O , O it O would O be O nice O if O one O day O , O iTunes O can O actually O offer O their O customers O a O monthly O service O that O allows O iPod O owners O to O load O their O iPods O up O with O unlimited O music O with O one O set O fee O , O as O an O option O to O the O pay-99cents-a-track O path O . O",ipod.txt,,[]
250,"Regardless O though O , O it O did O set O me O back O financially O but O now O , O I O 'm O glad O I O have O one O . O",ipod.txt,,[]
251,"I O go O everywhere O with O it O , O on O campus O , O in O the O gym O and O at O work O too O ! O",ipod.txt,,[]
252,By O far O the O best O MP3 O player O I O 've O ever O used O,ipod.txt,,[]
253,This O review O will O contain O some O comparisons O to O other O MP3 O players O mainly O the O Rio O Nitrus O for O interested O consumers O . O,ipod.txt,,[]
254,"If O you O want O to O know O exclusively O about O the O iPod O , O you O 'll O find O that O here O too O ! O RIO O VS. O IPOD O For O Christmas O I O was O given O a O Rio O Nitrus O 1.5 O GB O and O was O extremely O pleased O with O it O . O",ipod.txt,,[]
255,"However O I O looked O up O some O consumer O reviews O online O only O to O find O out O it O had O the O shortest O warranty O of O any O MP3 O player O on O the O market O , O and O was O notorious O for O having O poor O customer O service O and O completely O breaking O after O 90 O days O when O the O warranty O expires O , O surprise O , O surprise O . O",ipod.txt,,[]
256,I O still O have O my O Nitrus O and O stand O by O it O so O far O - O a O month O has O nearly O passed O and O it O 's O still O working O flawlessly O . O,ipod.txt,,[]
257,However O after O purchasing O a O 20 O GB O iPod B-aspect it O 's O clear O to O see O the O superiority O . O,ipod.txt,iPod[+2],['iPod']
258,"For O a O sleeker O , O smaller O and O more O `` O average O '' O MP3 O player O the O Nitrus O is O great O but O the O iPod B-aspect blows O it O out O of O the O water O - O the O interface B-aspect is O great O and O the O design B-aspect is O wonderful O . O",ipod.txt,"iPod[+3], interface[+3], design[+3]","['iPod', 'interface', 'design']"
259,"It O `` O feels O '' O much O more O professional O and O well O built O - O the O clickable O scroller O , O for O example O , O is O a O brilliant O invention O and O I O never O feel O as O if O I O 'm O going O to O perhaps O break O it O or O snap O it O off O as O I O sometimes O did O with O the O Nitrus O . O",ipod.txt,,[]
260,THE O CONS O OF O THE O IPOD O There O are O a O few O advantages O to O the O Nitrus O . O,ipod.txt,,[]
261,You O can O transfer O music O from O one O PC O to O the O other O . O,ipod.txt,,[]
262,"However O , O with O the O iPod O you O can O not O . O",ipod.txt,,[]
263,The O music O MUST O be O on O your O computer O . O,ipod.txt,,[]
264,If O you O plug O your O iPod O into O a O PC O and O try O to O upload O music/etc O . O it O wo O n't O work O . O,ipod.txt,,[]
265,"Someone O told O me O that O he O had O a O 40 O GB O iPod O , O and O after O his O computer O crashed O he O lost O his O paid O iTunes O music O files O . O",ipod.txt,,[]
266,"They O were O on O his O iPod O , O but O the O device O would O not O let O him O upload O the O files O onto O his O new O computer O ; O and O after O he O tried O , O the O iTunes O software O deleted O the O files O from O his O iPod O , O assuming O they O were O stolen O ? O . O",ipod.txt,,[]
267,"Also O , O some O other O MP3 O players O such O as O the O Nitrus O allow O you O to O play B-aspect WMA I-aspect Windows O Media O Audio O files O , O whereas O the O iPod O does O NOT O . O",ipod.txt,play WMA[-2],['play WMA']
268,"Considering O the O fact O that O just O about O any O CD O you O purchase O and O `` O rip O '' O to O your O hard O drive O will O be O formatted O as O a O WMA O file O , O iTunes O version O 4.5 O included O with O new O iPod O releases O contains O an O auto-converter O that O converts O WMA O to O MP3 O for O iPod O compatability O . O",ipod.txt,,[]
269,My O only O nitpick O with O this O is O that O it O sometimes O does O n't O work O on O certain O files O and O presents O error O messages O . O,ipod.txt,,[]
270,I O had O similar O trouble O with O my O Soundgarden O CD O - O the O ripped O tracks O continually O failed O to O convert O properly O to O MP3 O . O,ipod.txt,,[]
271,"So O , O I O downloaded O another O program O Switch O freeware O and O manually O changed O the O WMA O files O to O MP3 O , O then O downloaded O them O to O the O iPod O . O",ipod.txt,,[]
272,"The O problem O with O this O is O that O a O it O takes O a O LOT O of O time O if O you O have O many O files O and O b O audio O quality O is O somewhat O lost O if O you O 're O an O audiophile O , O this O will O bother O you O - O frankly O , O I O ca O n't O tell O the O difference O . O",ipod.txt,,[]
273,"Also O , O I O do O n't O like O how O when O I O first O set O up O my O iPod O , O it O took O me O about O four O hours O to O get O everything O going O - O the O new O iTunes O software O has O an O exploited O flaw O which O is O that O if O you O do O not O connect O your O iPod O to O your O PC O during O installation O , O it O will O not O configure O the O iPod O , O and O when O you O later O plug O it O into O your O computer O the O PC O will O recognize O it O as O an O external O device O rather O than O an O actual O iPod O , O and O you O will O not O be O able O to O use O the O iTunes O software O until O you O access O your O device O manager O and O change O the O iPod O `` O hard O drive O '' O to O a O new O letter O . O",ipod.txt,,[]
274,"If O this O sounds O confusing O , O just O make O sure O you O have O your O iPod O plugged O in O when O you O install O the O iTunes O software O ! O",ipod.txt,,[]
275,This O seems O obvious O but O the O flaw O lies O herein O : O the O instruction O booklet O tells O users O to O charge O their O iPods O 2 O - O 4 O hours O before O initial O use O . O,ipod.txt,,[]
