,text,dataset,aspect_str,aspects
0,Do O n't O get O this O ... O keep O browsing O . O,ipod.txt,,[]
1,The O iPod O has O so O far O been O one O of O the O most O advertised O and O populated O MP3 O players O so O far O . O,ipod.txt,,[]
2,I O 'm O still O figuring O out O why O . O,ipod.txt,,[]
3,"There O is O n't O much O features B-aspect on O the O iPod O at O all O , O except O games O . O",ipod.txt,features[-2],['features']
4,"My O friend O has O this O unit O while O not O experience O it O much O , O I O look O at O other O reviews O on O this O site O and O tried O out O the O unit O at O Best O Buy O , O and O it O 's O definitely O the O most O overrated O gadget O in O history O . O",ipod.txt,,[]
5,sound B-aspect QUALITY O : O The O iPod O 's O sound B-aspect quality O is O pretty O good O . O,ipod.txt,sound[+2],['sound']
6,"The O Creative O player O sounds O a O bit O better O , O but O not O anything O to O worry O about O . O",ipod.txt,,[]
7,"It O has O an O equalizer B-aspect , O but O the O iRiver O H10-20GB O has O a O lot O more O presets O than O the O iPod O . O",ipod.txt,equalizer[-1],['equalizer']
8,The O bass B-aspect is O deep O and O the O treble B-aspect is O clear O . O,ipod.txt,"bass[+3],treble[+2]","['bass', 'treble']"
9,"DURABILITY O : O Not O good O . O First O problem O , O if O you O have O n't O seen O the O news O recently O , O the O iPods O are O being O recalled O for O battery B-aspect problems O and O not O lasting O the O advertised O 18 O months O . O",ipod.txt,battery[-2],['battery']
10,"This O is O really O stupid O to O me O . O 18 O months O for O a O battery O is O n't O good O , O actually O , O it O 's O medicore O . O",ipod.txt,,[]
11,iRiver O 's O battery O lasts O four O to O five O years O . O,ipod.txt,,[]
12,"Also O , O the O battery O 's O ARE O N'T O USER O REPLACEABLE O . O",ipod.txt,Replaceable battery[-3],['Replaceable battery']
13,"However O , O the O Creative O and O iRiver O players O are O Rio O 's O is O n't O , O and O they O only O cost O around O $ O 30 O to O replace O , O while O iPod O charges O shipping O and O technical O support O . O",ipod.txt,,[]
14,"The O iPod O 's O battery O , O 1.5 O years O . O",ipod.txt,,[]
15,"Yeah O , O pretty O weak O . O",ipod.txt,,[]
16,"Another O thing O you O should O know O , O the O metal O on O the O flip B-aspect side I-aspect of O the O iPod O is O very O tacky O , O and O scratches O very O easily O . O",ipod.txt,flip side[-2],['flip side']
17,"While O all O MP3 O players O are O easy O to O scratch O , O the O iPod O is O the O worst O of O the O Creative O and O iRiver O . O",ipod.txt,,[]
18,"Also O , O not O liking O the O gel O case B-aspect . O",ipod.txt,case[-2],['case']
19,iRiver O 's O seems O a O lot O more O sturdier O than O the O iPod O 's O . O,ipod.txt,,[]
20,"features B-aspect : O Really O , O there O are O n't O any O features B-aspect , O unless O you O call O the O games O a O feature O . O",ipod.txt,features[-3],['features']
21,"There O is O no O FM B-aspect tuner I-aspect , O while O there O is O no O FM B-aspect tuner I-aspect on O the O Creative O Zen O on O the O micro O version O of O the O Zen O there O is O a O tuner O , O the O iRiver O H10-20GB O , O the O Rio O Karma O , O and O the O iAudio O X5 O have O FM O tuners O . O",ipod.txt,FM tuner[-3],['FM tuner']
22,"There O is O also O no O voice B-aspect recording I-aspect , O something O most O if O not O all O MP3 O players O have O that O the O iPod O does O n't O . O",ipod.txt,voice recording[-3],['voice recording']
23,"There O is O no O photo B-aspect viewing I-aspect option O , O however O , O there O is O a O 20 O GB O photo O iPod O , O but O it O costs O $ O 20 O more O . O",ipod.txt,photo viewing[-1],['photo viewing']
24,"There O is O an O alarm O and O timer O , O but O most O MP3 O players O have O this O feature O . O",ipod.txt,,[]
25,"EASE O OF O USE/DESIGN O : O The O iPod O is O a O very O easy O to O use B-aspect MP3 O player O , O and O if O you O ca O n't O figure O this O out O , O you O should O n't O even O own O one O . O",ipod.txt,use[+3],['use']
26,"The O Click O Wheel O is O a O great O design O , O something O no O one O else O came O up O with O however O , O the O iRiver O has O a O touchpad O . O",ipod.txt,,[]
27,I O 'm O probably O the O only O person O that O dislikes O the O iTunes B-aspect software O . O,ipod.txt,iTunes[-1],['iTunes']
28,"I O just O do O n't O like O it O , O the O weird O thing O is O , O I O do O n't O know O why O I O dislike O it O . O",ipod.txt,,[]
29,"Maybe O because O it O does O n't O have O a O lot O of O skins O to O choose O from O like O WMP O , O but O then O again O , O I O dislike O WMP O as O well O because O it O 's O slow O on O my O computer O . O",ipod.txt,,[]
30,"Anyhow O , O adding O music O to O the O player O is O easy O . O",ipod.txt,,[]
31,"BATTERY O LIFE O : O Pretty O medicore O at O 12 O hours O , O the O Creative O , O iAudio O , O Rio O , O and O iRiver O players O last O longer O . O",ipod.txt,,[]
32,"CUSTOMER B-aspect SERVICE I-aspect : O Awful O . O Listen O to O this O one O , O remember O the O battery O statement O I O made O earlier O . O",ipod.txt,CUSTOMER SERVICE[-3],['CUSTOMER SERVICE']
33,"If O your O battery O dies O and O it O 's O still O under O warranty O , O guess O what O , O you O 're O out O of O luck O , O because O Apple O does O n't O cover O the O battery O in O the O iPod O warranty O . O",ipod.txt,,[]
34,They O have O the O nerve O to O charge O you O $ O 30 O for O a O warrantied O iPod O . O,ipod.txt,,[]
35,There O technical B-aspect service I-aspect is O n't O helpful O either O ; O they O just O read O what O 's O on O their O website O and O charge O you O $ O 50 O + O toll O fees O to O do O it O . O,ipod.txt,technical service[-3],['technical service']
36,At O least O Creative O and O iRiver O 's O only O charge O toll O fees O like O most O companies O . O,ipod.txt,,[]
37,"OVERALL O : O I O highly O dislike O the O iPod B-aspect , O even O though O the O sound B-aspect quality I-aspect and O design B-aspect is O above-average O . O",ipod.txt,"iPod[-3], sound quality[+2], design[+2]","['iPod', 'sound quality', 'design']"
38,"Maybe O in O their O 5th O generation O they O 'll O add O features O to O the O iPod O . O But O for O now O , O pleases O do O n't O buy O this O , O and O buy O a O Creative O Zen O or O the O iRiver O H10-20GB O instead O . O",ipod.txt,,[]
39,"God O Save O Apple O I O have O been O an O Apple O person O since O 1984 O , O when O I O got O my O first O Mac O . O",ipod.txt,,[]
40,"Since O then O , O I O have O been O a O devotee O of O the O elegant O styling O and O functionality O of O all O things O Apple O . O",ipod.txt,,[]
41,The O Ipod B-aspect is O a O fine O cousin O to O the O early O macs O and O current O offerings O from O Jobs O and O Company O . O,ipod.txt,Ipod[+2],['Ipod']
42,"Long O live O Apple B-aspect , O long O live O Macs O , O and O long O live O the O Ipod O ! O",ipod.txt,Apple[+2],['Apple']
43,I O have O an O ipod B-aspect and O it O is O a O great O buy O . O,ipod.txt,ipod[+2],['ipod']
44,It O holds O a O ton O of O songs O and O looks O cool O in O the O palm O of O your O hand O . O,ipod.txt,,[]
45,Very O sturdy B-aspect and O strong O . O,ipod.txt,sturdy[+2],['sturdy']
46,Does O n't O have O alot O of O good O games B-aspect on O it O . O,ipod.txt,games[-1],['games']
47,"the O 20 O gig O because O that O holds O 10,000 O songs O right O there O and O that O 's O alot O of O songs O . O",ipod.txt,,[]
48,"iPod B-aspect is O brilliant O , O but O service B-aspect was O awful O",ipod.txt,"iPod[+3],service[-2]","['iPod', 'service']"
49,Wow O iPod O . O,ipod.txt,,[]
50,How O did O we O listen O to O music O before O it O ? O,ipod.txt,,[]
51,"This O 20 O gigabyte O iPod O by O Apple O Computer O allows O you O to O put O up O to O 5000 O songs O onto O it O , O in O a O choice O of O digital O formats O . O MP3 O , O AAC O , O etc O . O",ipod.txt,,[]
52,"The O software O with O the O iPod O includes O iTunes B-aspect , O which O allows O you O to O play O the O music O on O your O computer O , O rip O CDs O onto O your O computer O , O and O move O your O music O from O the O computer O to O the O iPod O . O",ipod.txt,iTunes[+2],['iTunes']
53,"iTunes O is O a O great O piece O of O software O , O and O you O can O also O buy O songs O from O the O iTunes O Store O at O 99 O cents O per O download O . O",ipod.txt,,[]
54,This O new O click B-aspect wheel I-aspect iPod O allows O you O to O navigate O through O the O menus O and O song O via O a O touch-wheel O for O scrolling O and O click-able O buttons O for O selection O . O,ipod.txt,click wheel[+2],['click wheel']
55,It O allows O fast O and O easy O navigation O . O,ipod.txt,,[]
56,The O backlit O screen O of O the O iPod O is O also O easy O to O read O . O,ipod.txt,,[]
57,"The O song B-aspect quality I-aspect of O the O iPod O is O excellent O , O and O the O included O ear B-aspect buds I-aspect are O actually O more O than O satisfactory O , O for O most O users O . O",ipod.txt,"song quality[+3],ear buds[+3]","['song quality', 'ear buds']"
58,"The O back O of O the O iPod O is O in O a O chrome O finish O , O and O this O surface O is O prone O to O scratches B-aspect . O",ipod.txt,scratches[-1],['scratches']
59,It O is O best O to O protect O the O iPod O in O a O case O of O some O kind O . O,ipod.txt,,[]
60,"Battery B-aspect life I-aspect keeps O improving O on O the O iPod O , O and O a O new O iPod O will O give O you O up O to O twelve O hours O of O play O time O , O per O charge O . O",ipod.txt,Battery life[+1],['Battery life']
61,I O use O my O iPod O all O the O time O . O,ipod.txt,,[]
62,"You O can O also O use O it O as O an O external O hard O drive O to O back-up O documents O , O photographs O , O etc O . O",ipod.txt,,[]
63,The O problem O with O my O iPod O . O,ipod.txt,,[]
64,The O first O one O I O received O skipped O songs O randomly O . O,ipod.txt,,[]
65,"I O had O to O send O it O in O for O repair O , O and O it O took O six O weeks O to O get O a O replacement O back O to O me O . O",ipod.txt,,[]
66,"I O actually O had O to O contact O Apple O 's O Vice-president O , O in O order O to O get O the O situation O resolved O . O",ipod.txt,,[]
67,"However O , O he O quickly O helped O me O , O and O I O have O been O enjoying O my O replacement O 20 O gigabyte O click-wheel O iPod O for O several O months O now O . O",ipod.txt,,[]
68,Thank O you O Apple B-aspect ! O You O make O fabulous O products O . O,ipod.txt,Apple[+2],['Apple']
69,"The O product B-aspect I O rate O five O stars O , O",ipod.txt,product[+2],['product']
70,but O I O had O to O give O you O four O because O the O service B-aspect for O my O brand-new O iPod O was O terribly O slow O . O,ipod.txt,service[-2],['service']
71,"However O , O you O should O still O buy O an O iPod O ! O",ipod.txt,,[]
72,The O chances O of O getting O a O flawed O one O is O very O small O indeed O . O,ipod.txt,,[]
73,"Plus O , O if O you O order O from O Amazon.com O , O they O will O exchange O it O for O you O no O problem O . O",ipod.txt,Amazon[+2],['Amazon']
74,"I O had O ordered O a O customized O one O from O Apple.com O , O so O I O could O n't O exchange O it O . O",ipod.txt,,[]
75,iPod O will O change O the O way O you O enjoy O music O ! O,ipod.txt,,[]
76,Very O Pleased O . O,ipod.txt,,[]
77,"I O 'd O never O had O an O MP3 O player O before O , O so O this O was O a O new O one O on O me O . O",ipod.txt,,[]
78,The O interface B-aspect took O a O little O getting O used O to O . O,ipod.txt,interface[-1],['interface']
79,The O best O thing O for O anyone O to O do O who O has O not O used O one O is O to O ask O the O store O clerk O at O apple O or O a O teenager O for O advice O on O how O to O operate O it O . O,ipod.txt,,[]
80,"This O one O has O a O color O display B-aspect , O which O I O like O a O lot O , O being O very O visual O . O",ipod.txt,display[+2],['display']
81,"I O loaded O a O lot O of O photos B-aspect into O it O and O they O display O very O clearly O for O such O a O small O screen O and O , O very O importantly O , O the O transition O from O one O photo O to O the O next O is O instantaneous O . O",ipod.txt,photos[+2],['photos']
82,The O sound B-aspect is O just O fine O . O,ipod.txt,sound[+1],['sound']
83,"I O 'm O not O a O big O audiophile O , O but O I O have O no O objections O to O how O it O sounds O . O",ipod.txt,,[]
84,I O use O it O to O listen O to O language O tapes O and O to O play O `` O Earl O '' O by O the O Dixie O Chicks O incessantly O . O,ipod.txt,,[]
85,"It O comes O with O an O adapter B-aspect to O plug O into O the O wall O , O which O I O hear O is O a O step O up O from O the O other O iPods O , O which O require O you O plug O it O into O a O computer O to O charge O it O . O",ipod.txt,adapter[+1],['adapter']
86,"I O also O have O been O using O it O as O a O USB O device O , O which O just O tickles O me O no O end O . O",ipod.txt,,[]
87,"Now O , O I O can O back O up O what O little O I O keep O on O my O computer O quickly O and O without O a O fuss O . O",ipod.txt,,[]
88,One O caveat O I O have O is O that O I O understand O the O iPod O does O not O save O the O photos O in O such O a O way O that O the O quality O of O the O image O is O preserved O . O,ipod.txt,photo quality[-1],['photo quality']
89,I O think O its O the O 21st O century O version O of O the O wallet O with O little O photos O . O,ipod.txt,,[]
90,Here O 's O the O TRUTH O in O short O ... O . O,ipod.txt,,[]
91,"This O is O a O great O device O , O but O there O are O its O pros O and O cons O . O",ipod.txt,,[]
92,Pros O : O Large O Hard B-aspect Drive I-aspect for O the O $ O $ O -- O 20GB O and O 40GB O are O both O affordable B-aspect . O,ipod.txt,"Hard Drive[+2], affordable[+2]","['Hard Drive', 'affordable']"
93,Decently O Sized O Screen B-aspect -- O One O of O the O larger O ones O on O the O market O at O 2 O '' O,ipod.txt,Screen[+2],['Screen']
94,"Decent O Battery B-aspect -- O On O the O average O size O , O but O the O 40GB O comes O with O a O dock O . O",ipod.txt,Battery[+1],['Battery']
95,"12 O hours O is O about O average O , O and O it O has O an O AC O adapter O in O the O box O , O with O quick O charge O 2 O hours O at O probably O 80 O % O ... O and O 4 O hours O for O a O full O charge O . O",ipod.txt,,[]
96,"FireWire B-aspect & O USB2.0 O -- O For O those O fortunate O enough O to O have O FireWire400 O , O your O in O for O a O real O treat O with O autosync O . O",ipod.txt,"FireWire[+3],USB[+3]","['FireWire', 'USB']"
97,"Great O Design B-aspect -- O Very O sleek O and O touch O wheel O has O still O never O been O successfully O copied O vertal O ones O are O the O only O competition O ; O and O now O the O wheel O clicks O , O taking O away O a O lot O of O headaches O from O 3rd O gen O and O very O navigable O in O the O menus O . O",ipod.txt,Design[+3],['Design']
98,"Good O sound B-aspect -- O Plays O very O nicely O , O even O though O the O stock O headphones O are O kind O of O weak O Durable B-aspect -- O not O the O most O Durable B-aspect because O its O mostly O plastic O , O but O very O compact B-aspect and O sturdy O",ipod.txt,"sound[+2],Durable[+2],compact[+1]","['sound', 'Durable', 'compact']"
99,"Games B-aspect -- O not O really O important O , O but O existant O",ipod.txt,Games[+1],['Games']
100,"Hold B-aspect Button O -- O suprisingly O not O all O MP3s O have O this O ; O this O allows O you O to O have O all O the O buttons O unusable O , O so O that O you O do O n't O accidently O hit O something O in O your O pocket O . O",ipod.txt,Hold[+1],['Hold']
101,Cons O : O No O AM/FM O Radio B-aspect Tuner I-aspect -- O Something O a O large O number O of O competetors O are O doing O,ipod.txt,Radio Tuner[-2],['Radio Tuner']
102,3 O No O Voice B-aspect Recorder I-aspect -- O this O has O also O become O an O important O and O popular O feature O that O the O iPod O unfortunately O does O n't O have O . O,ipod.txt,Voice Recorder[-2],['Voice Recorder']
103,"No O Memory B-aspect Stick I-aspect slots I-aspect -- O Although O a O rare O feature O , O it O would O be O nice O to O have O extra O storage O , O not O that O it O needs O it O Built-in O Lithium O Battery B-aspect -- O A O huge O hassle O to O bring O this O back O ; O draining O the O Battery B-aspect once O you O get O it O helps O , O but O removable/replaceable O ones O are O a O lot O more O convenient O",ipod.txt,"Memory Stick slots[-2],Battery[-2]","['Memory Stick slots', 'Battery']"
104,". O iTunes B-aspect -- O this O is O a O love-hate O relationship O program O ; O usually O people O with O Mac O like O this O program O than O people O with O a O PC O , O but O depending O on O your O computer O expertise O , O this O could O be O a O difficult O program O to O use O , O and O it O is O required O for O an O iPod O . O",ipod.txt,iTunes[+1],['iTunes']
105,"No O inbox O accessories B-aspect -- O An O arm O strap O , O belt O strap O , O case O , O or O anything O would O be O nice O , O but O nope O ... O Moveable O parts O -- O This O makes O me O almost O want O to O keep O my O 3rd O gen O over O a O 4th O ; O with O moveable O parts O , O its O easy O to O damage O an O iPod O at O a O gym O , O so O this O is O for O more O casual O listeners O ; O note O the O iPod O Mini O does O n't O have O moveable O parts O and O is O made O of O titanium O . O",ipod.txt,accessories[-1],['accessories']
106,"Comments O : O Overall B-aspect this O is O still O a O great O value O , O but O is O kind O of O overrated O in O the O sense O that O there O are O beater O deals O on O the O market O . O",ipod.txt,Overall[+1],['Overall']
107,"A O lot O of O people O go O for O the O iPod O because O of O its O reputation O , O but O if O you O honestly O shop O around O and O check O out O the O reviews O on O Cnet O and O things O like O that O , O you O can O find O a O better O 20GB O HD O MP3 O player O . O",ipod.txt,,[]
108,"This O is O definately O worth O the O money O to O have O , O but O certain O aspects O of O it O does O n't O make O it O the O best O . O",ipod.txt,,[]
109,Get O an O ARCHOS O Gmini400 O instead O If O you O are O doing O your O research O and O thinking O whether O iPod O is O right O for O you O ... O give O the O ARCHOS O Gmini400 O a O look O . O,ipod.txt,,[]
110,I O returned O my O 20G O iPod O 7 O months O ago O and O got O a O Gmini O instead O . O,ipod.txt,,[]
111,A O sound O decision O and O a O happy O customer O right O here O ! O,ipod.txt,,[]
112,I O look O at O iPod O owners O today O and O quietly O feel O sorry O for O them O . O : O They O just O did O n't O know O about O the O ARCHOS O gmini400 O . O,ipod.txt,,[]
113,"The O Gmini O is O like O an O iPod O VIDEO O , O PHOTO O , O GAME O , O MUSIC O , O all O into O ONE O and O it O is O exactly O the O same O size O as O the O iPod O ... O and O you O can O play O any O MP3 O directly O and O fresh O from O the O NET O ... O oh O yeah O , O even O audio O books O , O anything O ! O",ipod.txt,,[]
114,"It O 's O a O plug O n O play O device O , O recognized O as O MASS O STORAGE O DEVICE O on O any O windows O xp O computer O . O",ipod.txt,,[]
115,No O need O to O install O the O iTunes O . O,ipod.txt,,[]
116,Versatile B-aspect and O stylish O . O,ipod.txt,Versatile[+2],['Versatile']
117,"I O had O a O Casio O unit O , O which O had O given O great O service O , O and O would O have O been O happy O to O get O another O one O , O but O was O tempted O by O the O iPod O 's O sleek O design B-aspect , O storage O capacity B-aspect , O connection O options- O - O firewire O and O USB O , O and O its O integration O with O iTunes B-aspect . O",ipod.txt,"design[+2],capacity[+2],connection options[+2],iTunes[+2]","['design', 'capacity', 'connection options', 'iTunes']"
118,"The O battery B-aspect issue O is O superficially O a O concern O , O but O any O reasonable O solder-jockey O such O as O myself O : O - O can O pop O in O a O new O one O when O the O time O comes O based O upon O the O plentiful O info O gained O from O a O google O for O 'ipod O battery B-aspect replacement O ' O . O",ipod.txt,battery[-1],['battery']
119,The O controls B-aspect and O the O menus O are O clearly O displayed O and O easily O fathomed O,ipod.txt,controls[+2],['controls']
120,"And O it O 's O easily O connected O to O a O Linux O or O FreeBSD O machine O for O loading O and O unloading O files O , O so O I O can O also O retire O my O ZIP O drive O . O",ipod.txt,,[]
121,"The O iPod B-aspect is O a O very O nice O product O , O which O given O reasonable O care O , O should O give O a O lot O of O service O . O",ipod.txt,iPod[+2],['iPod']
122,Still O not O so O sure O about O this O one O ... O,ipod.txt,,[]
123,"First O , O let O me O say O that O I O got O the O 20gb O iPod B-aspect for O Christmas O , O and O I O most O likely O would O not O have O spent O the O $ O 300 O myself O . O",ipod.txt,iPod[-1],['iPod']
124,"So O far O , O in O the O month O that O I O have O had O it O , O I O have O had O to O take O it O in O for O service O twice O . O",ipod.txt,,[]
125,"This O is O a O hassle O , O of O course O , O but O I O 'm O not O sure O if O the O problems O are O to O blame O on O poor O construction O , O cold O weather O , O or O misuse O by O yours O truly O . O",ipod.txt,,[]
126,"In O addition O , O I O do O not O think O the O battery B-aspect lasts O much O more O than O eight O to O ten O hours O , O and O it O can O take O four O hours O for O a O full O charge O . O",ipod.txt,battery[-2],['battery']
127,"Again O , O another O hassle O . O",ipod.txt,,[]
128,"To O be O sure O , O I O am O not O looking O forwards O to O paying O for O the O battery O replacement O , O whenever O that O may O come O . O",ipod.txt,,[]
129,But O enought O of O the O negativity O . O,ipod.txt,,[]
130,"I O have O about O 6 O gb O used O on O my O iPod O so O far O well O over O 1000 O songs O , O and O as O far O as O I O can O tell O , O all O of O them O play O at O near-cd O quality B-aspect . O",ipod.txt,quality[+2],['quality']
131,"Sound O quality O is O more O dependant O on O the O quality O of O the O original O source O and O of O the O unit O used O to O broadcast O headphones O , O stereo O , O etc O . O",ipod.txt,,[]
132,"Other O than O the O fact O that O one O ca O n't O delete O a O file O directly O from O the O iPod O , O the O interface B-aspect is O excellent O and O mind-numbingly O simple O to O use B-aspect . O",ipod.txt,"interface[+2], use[+3]","['interface', 'use']"
133,Someone O wrote O that O they O have O n't O been O able O to O upload O songs O from O burned O cds O ; O I O have O not O found O this O to O be O so O . O,ipod.txt,,[]
134,"I O have O several O hundred O songs O from O burned O albums O , O at O they O all O worked O fine O . O",ipod.txt,,[]
135,"As O for O iTunes B-aspect , O I O do O n't O find O it O to O be O as O good O as O the O Windows O Media O Player O as O a O computer O mp3 O player O , O but O it O is O good O enough O . O",ipod.txt,iTunes[+1],['iTunes']
136,"I O have O n't O used O it O to O purchase O any O files O , O so O I O do O n't O know O about O that O . O",ipod.txt,,[]
137,"All O in O all O , O it O does O what O it O is O supposed O to O do O with O minimal O frustration O . O",ipod.txt,,[]
138,"In O conclusion O , O I O gave O the O iPod B-aspect a O 4/5 O because O anything O this O expensive O should O would O work O just O about O flawlessly O . O",ipod.txt,iPod[+2],['iPod']
139,"In O the O end O , O I O have O n't O used O it O long O enough O to O say O that O it O is O worth O the O extra O money O . O",ipod.txt,,[]
140,"Do O your O research O before O you O buy O it O , O and O especially O talk O to O other O owners O . O",ipod.txt,,[]
141,i O 've O had O a O beastly O experience O from O trying O to O buy O an O ipod O from O circuit O city O . O,ipod.txt,,[]
142,"when O i O got O the O ipod O , O i O slid O the O box O out O of O its O sheath O and O the O whole O thing O tumbled O out O ! O",ipod.txt,,[]
143,simply O put O somebody O had O already O opened O the O box O earlier O ! O,ipod.txt,,[]
144,the O packing O inside O was O in O tatters O . O,ipod.txt,,[]
145,i O didnt O touch O the O product O . O,ipod.txt,,[]
146,i O called O circuit O city O and O complained O that O they O had O sent O me O an O already O opened O box O . O,ipod.txt,,[]
147,they O initially O told O me O that O i O would O have O to O ship O it O back O to O them O on O my O own O cost O . O,ipod.txt,,[]
148,then O when O i O argued O with O them O they O told O me O that O they O would O pick O it O up O . O,ipod.txt,,[]
149,a O week O passed O but O it O was O never O picked O up O . O,ipod.txt,,[]
150,the O when O i O called O they O said O they O werent O responsible O for O open O packages O because O they O couldnt O verify O it O being O open O when O i O received O it O why O else O would O i O want O to O return O it O if O not O for O this O ? O if O the O product O was O defective O i O would O have O complained O so O and O that O if O i O returned O it O i O would O have O to O pay O a O 15 O % O restocking O fee O ! O i O 'm O at O my O wits O end O with O this O company O . O,ipod.txt,,[]
151,buyers O BEWARE O ! O,ipod.txt,,[]
152,There O 's O got O to O be O a O better O solution O ... O,ipod.txt,,[]
153,"I O bought O my O IPOD O roughly O six O months O ago O , O and O I O 've O been O pretty O disappointed O so O far O . O",ipod.txt,,[]
154,*The O ipod O is O overly O sensitive B-aspect to O just O about O everything O and O gets O scratched O easily O . O,ipod.txt,sensitive[-2],['sensitive']
