,text,dataset,aspect_str,aspects
276,"In O the O meantime O , O users O will O obviously O begin O to O install O their O software O - O and O since O the O charger O takes O up O the O underbelly O of O the O iPod O and O USB O connection O to O the O computer O , O it O 's O impossible O to O hook O it O up O to O your O PC O during O installation O without O unplugging O the O charge O adapter O and O actually O turning O the O iPod O on O - O which O we O 're O not O supposed O to O do O for O 2 O - O 4 O hours O ! O",ipod.txt,,[]
277,Confused O yet O ? O Do O n't O be O . O,ipod.txt,,[]
278,This O is O really O the O only O downside O to O the O iPod O - O setting O it O up O and O downloading O music O . O,ipod.txt,,[]
279,The O actual O experience O of O USING B-aspect the O iPod O is O magnificent O . O,ipod.txt,USING[+2],['USING']
280,"THE O PROS O The O bad O ends O here O , O because O as O far O as O I O 'm O concerned O the O rest O of O ... O well O ... O everything O concering O the O iPod O is O an O enormous O PLUS O ! O",ipod.txt,,[]
281,"The O design B-aspect , O as O mentioned O above O , O is O sleek O , O cool O and O trendy O and O I O think O trendy O = O good O , O but O it O 's O always O hard O to O tell O these O days O . O",ipod.txt,design[+2],['design']
282,"The O battery B-aspect life O lastes O 12 O hours O , O and O charges O quickly O . O As O mentioned O above O , O the O initial O charge O is O a O minimum O of O only O two O hours O - O not O too O long O at O all O ! O Once O you O 've O downloaded O your O music O , O you O can O access O the O tracks O by O artist O , O genre O , O album O , O composer O this O comes O in O handy O when O the O actual O composer O is O different O from O the O artist O - O e.g O . O covers O of O songs O , O etc O . O",ipod.txt,battery[+2],['battery']
283,The O list O is O endless O . O,ipod.txt,,[]
284,The O entire O database O is O set O up O flawlessly O and O really O works O well O . O,ipod.txt,,[]
285,I O love O scrolling O through O the O menus O - O that O may O sound O strange O but O that O 's O how O FUN O using O the O iPod O actually O is O ! O,ipod.txt,,[]
286,The O ! O sound B-aspect quality I-aspect is O great O . O,ipod.txt,sound quality[+3],['sound quality']
287,The O included O earphones B-aspect are O pretty O good O - O my O advice O ? O,ipod.txt,earphones[+1],['earphones']
288,Do O n't O apply O the O black O cushioned O protectors O . O,ipod.txt,,[]
289,"First O of O all O , O no O one O does O this O and O it O will O make O you O stand O out O and O look O `` O uncool O . O '' O",ipod.txt,,[]
290,Just O kidding O . O,ipod.txt,,[]
291,"But O really O , O EVERYONE O I O 've O seen O with O an O iPod O leaves O them O off O . O",ipod.txt,,[]
292,But O unlike O most O fashion O statements O if O this O could O indeed O be O seen O as O one O ? O this O concept O is O a O logical O one O - O the O black O cushions O often O cover O up O the O letters O on O the O earbuds O that O designate O whether O they O 're O for O your O left O or O right O ear O . O,ipod.txt,,[]
293,"I O had O to O constantly O peel O mine O off O to O see O which O was O which O , O so O I O finally O just O got O rid O of O the O cushions O and O do O n't O even O notice O the O difference O . O",ipod.txt,,[]
294,The O ease O of O use B-aspect of O the O iPod O is O a O major O attribute O . O,ipod.txt,use[+2],['use']
295,"As O mentioned O above O , O accessing O songs O is O simultaneously O easy O and O fun O . O",ipod.txt,,[]
296,"With O the O iPod O , O you O can O also O store O documents O and O contact O files O from O programs O such O as O Microsoft O Outlook O when O it O 's O connected O to O your O PC O as O an O external O hard B-aspect drive I-aspect . O",ipod.txt,hard drive[+1],['hard drive']
297,This O is O good O for O the O businessmen O who O listen O to O music O on O their O commute O and O can O rely O on O the O iPod O to O even O carry O around O some O of O their O word O documents O . O,ipod.txt,,[]
298,"I O 'm O sure O future O generations O of O the O iPod O will O be O able O to O carry O much O more O , O probably O even O videos O . O",ipod.txt,,[]
299,Also O included O in O the O `` O games B-aspect '' O section O is O the O great O music O trivia O option O - O which O tests O your O skill O at O being O able O to O quickly O place O your O own O songs O . O,ipod.txt,games[+1],['games']
300,"The O game O plays O a O segment O of O a O song O , O and O gives O you O a O multiple-choice O list O wherein O you O have O a O short O period O of O time O to O choose O the O title O of O the O song O from O a O list O of O others O . O",ipod.txt,,[]
301,What O 's O great O about O this O is O that O it O 's O a O game O based O on O YOUR O music O . O,ipod.txt,,[]
302,When O I O first O saw O `` O music O trivia O quiz O '' O I O thought O it O was O some O pre-programmed O elitist O thing O - O it O 's O not O . O,ipod.txt,,[]
303,It O 's O a O lot O of O fun O and O really O tests O your O reflexes O . O,ipod.txt,,[]
304,It O 's O a O good O way O to O pass O the O time O . O,ipod.txt,,[]
305,"20 O GB O OR O 40 O GB O ? O The O pros O of O the O 40 O GB O : O Comes O with O a O `` O dock O station O '' O and O double O storage B-aspect space I-aspect 10,000 O songs O . O",ipod.txt,storage space[+2],['storage space']
306,"Cons O of O the O 40 O GB O : O Much O more O expensive O just O for O some O extra O space O and O a O docking O station O , O both O of O which O you O do O n't O really O need O . O",ipod.txt,,[]
307,"Think O about O it O for O a O minute O - O the O 20 O GB O holds O 5,000 O songs O : O more O than O you O 're O ever O likely O to O need O at O any O one O time O . O",ipod.txt,,[]
308,"If O you O want O to O add O more O , O just O delete O some O that O you O have O n't O been O listening O to O recently O . O",ipod.txt,,[]
309,"I O mean O , O for O music O buffs O and O archivists O - O use O your O PC O as O the O archive O , O not O the O iPod O ! O",ipod.txt,,[]
310,"It O 's O just O my O personal O advice O but O you O 're O saving O a O lot O of O money O and O from O personal O experience O the O docking O station O is O really O sort O of O a O rip-off O - O based O on O the O sleek O design O of O the O iPod O , O it O 's O very O easy O to O simply O lay O it O down O without O damaging O it O or O anything O . O",ipod.txt,,[]
311,"Overall O the O iPod B-aspect really O is O an O almost O flawless O beast O . O The O capacity B-aspect in O the O 20 O GB O is O more O than O I O think O most O people O would O ever O need O and O , O for O the O price B-aspect , O I O highly O recommend O it O . O",ipod.txt,"iPod[+2], capacity[+2], price[+2]","['iPod', 'capacity', 'price']"
312,At O $ O 290 O the O price O I O paid O it O 's O quite O a O bargain O . O,ipod.txt,,[]
313,"My O ONLY O complaint O thus O far O is O the O process O of O downloading O tracks O to O the O iPod O itself O - O the O iTunes O software O is O really O a O hassle O , O above O all O else O the O whole O concept O of O WMA O and O the O faulty O built-in O converter O",ipod.txt,,[]
314,". O But O the O iPod O itself O is O totally O flawless O as O far O as O I O 'm O concerned O , O and O the O best O MP3 O player O on O the O market O . O",ipod.txt,,[]
315,"Whether O you O 're O on O the O go O or O just O want O to O lounge O around O the O house O listening O to O music O , O you O could O definitely O do O much O , O much O worse O than O purchasing O this O durable O and O reliable O product O from O Apple O . O",ipod.txt,,[]
316,"Would O be O FIVE O STARS O , O except O for O MAJOR O FLAW O",ipod.txt,,[]
317,"Let O me O say O first O , O that O I O have O always O been O a O hater O of O all O things O Apple O . O",ipod.txt,,[]
318,"However O , O after O holding O an O ipod O at O circuit O city O , O I O knew O I O had O to O have O one O . O",ipod.txt,,[]
319,"When O I O finally O got O it O , O I O was O amazed O by O how O asthetically O pleasing O everything O was O , O including O the O packaging O . O",ipod.txt,,[]
320,The O ipod O itself O is O very O pleasing O to O hold O with O its O smooth O surfaces O . O,ipod.txt,,[]
321,The O only O thing O that O protrudes O slightly O is O the O `` O hold O '' O switch O . O,ipod.txt,,[]
322,"For O this O reason O , O it O is O very O easy O to O drop O . O",ipod.txt,,[]
323,"One O of O the O other O reviewers O said O get O the O neoprene O case O from O marware O , O which O is O great O advice O . O",ipod.txt,,[]
324,"I O have O almost O dropped O the O ipod O several O times O , O just O because O it O is O so O smooth O . O",ipod.txt,,[]
325,"Everything O else O about O the O ipod O is O great O , O the O click O wheel O is O very O easy O to O use O and O so O is O the O software O that O comes O with O it O . O",ipod.txt,"Itunes[+2][u],Design[+2][u]","['Itunes', 'Design']"
326,"To O adjust O the O volume O , O you O just O sweep O your O finger O lightly O along O the O click O wheel O . O",ipod.txt,,[]
327,Organizing O music O is O a O breeze O too O . O,ipod.txt,,[]
328,"You O can O put O songs O in O multiple O categories O , O which O is O great O . O ! O",ipod.txt,,[]
329,"Finding B-aspect all O the O albums O , O songs O etc O is O much O easier O than O you O would O think O it O would O be O even O if O you O have O 20 O gig O well O 18 O gig O worth O of O music O . O",ipod.txt,Finding[+2][u],['Finding']
330,It O all O sounds B-aspect great O too O . O,ipod.txt,sounds[+3],['sounds']
331,"As O with O most O headphones B-aspect that O come O with O any O type O of O music O player O , O I O recommend O throwing O these O into O the O nearest O river O , O unless O you O like O having O hard O , O round O pieces O of O plastic O in O your O ears O . O",ipod.txt,headphones[-3],['headphones']
332,I O recommend O Shures O shure.com O . O,ipod.txt,,[]
333,"I O have O the O e3c O 's O , O and O man O does O everything O on O the O ipod O sound O great O . O",ipod.txt,,[]
334,You O can O even O use O the O ipod O to O store B-aspect files O from O your O pc O and O export O your O outlook O files O to O it O . O,ipod.txt,store[+2],['store']
335,I O use O a O great O free O program O called O ipod O agent O to O do O this O . O,ipod.txt,,[]
336,"The O outlook O is O a O little O clunky O to O use O on O the O ipod O , O but O it O is O functional O . O",ipod.txt,,[]
337,"I O LOVE O THIS O IPOD O ! O So O why O , O you O ask O , O did O I O give O it O only O one O star O ? O",ipod.txt,,[]
338,Because O Steve O Jobs O is O a O twisted O individual O and O he O made O sure O that O he O ruined O this O device O by O giving O it O an O UNREPLACABLE O 18 O MONTH O BATTERY B-aspect . O,ipod.txt,BATTERY[-3],['BATTERY']
339,"To O see O a O great O little O short O film O about O this O , O go O to O ipodsdirtysecret.com O",ipod.txt,,[]
340,"Basically O , O this O is O a O disposable O device O , O the O idea O being O that O when O the O battery O goes O out O , O you O will O buy O the O latest O model O of O ipod O . O",ipod.txt,,[]
341,This O was O obviously O a O conspiracy O as O it O is O FREAKIN O ' O EASY O to O manufacture O a O device O with O replaceable O batteries B-aspect ! O ! O,ipod.txt,batteries[-3],['batteries']
342,"If O you O can O get O past O this O little O flaw O , O give O the O ipod O 5 O stars O , O because O everything O else O about O it O is O pretty O much O perfect O . O",ipod.txt,,[]
343,"However O , O in O my O mind O , O $ O 299 O is O a O lot O to O pay B-aspect for O a O device O that O will O only O last O 18 O MONTHS O . O",ipod.txt,pay[-3],['pay']
344,"Hence O , O the O one O star O rating O ... O",ipod.txt,,[]
345,"Good O , O But O Not O For O Everyone O",ipod.txt,,[]
346,"I O was O shopping O for O a O MP3 O player O recently O , O and O had O the O opportunity O to O play O with O my O cousin O 's O 20GB O iPod O at O some O length O to O see O how O I O liked O it O . O",ipod.txt,,[]
347,"I O had O initially O been O planning O on O buying O this O or O another O Apple O product O , O but O since O decided O to O buy O a O player O made O by O a O different O manufacturer O . O",ipod.txt,,[]
348,"Overall O , O I O think O the O iPod O is O a O good O player O , O although O I O would O note O some O features O that O turned O me O off O : O",ipod.txt,,[]
349,LOOKS O AND O DURABILITY O : O I O realize O many O people O are O fond O of O the O minimalist O white O interface B-aspect . O,ipod.txt,interface[-2],['interface']
350,I O 'm O not O one O of O them O . O,ipod.txt,,[]
351,"While O I O like O the O minimialism O of O the O player O , O I O try O to O avoid O plastic O products O made O of O white- O they O tend O to O yellow O with O age O . O",ipod.txt,,[]
352,"While O they O have O released O those O `` O tattoos O '' O for O the O players O , O I O think O those O just O look O cheap O and O gaudy O , O especially O since O they O leave O the O corners O of O the O iPod O exposed O . O",ipod.txt,,[]
353,"The O biggest O red O flag O for O me O was O the O fact O that O although O my O cousin O 's O player O was O relatively O new O , O it O was O riddled O with O scratches B-aspect . O",ipod.txt,scratches[-2],['scratches']
354,"While O he O 's O not O the O most O careful O guy O in O the O world O , O it O was O really O beat O up O consider O the O minimal O amount O he O uses O the O thing O , O and O talking O to O other O people O who O have O iPods O confirmed O that O the O player O scratches O very O easily- O and O from O personal O experience O , O they O look O terrible O scratched O up O . O",ipod.txt,,[]
355,"THE O CLICKWHEEL O : O Again O , O I O realize O that O most O people O think O this O is O the O greatest O thing O since O sliced O bread O . O",ipod.txt,,[]
356,I O disagree O . O,ipod.txt,,[]
357,I O strongly O suggest O anyone O considering O an O iPod O test O it O out O first O to O see O how O they O like O it O . O,ipod.txt,,[]
358,"I O thought O the O clickwheel O sounded O great O , O but O after O trying O it O found O it O awkward O . O",ipod.txt,,[]
359,"As O a O student O , O I O spend O a O significant O amount O of O time O on O my O laptop O and O am O used O to O scrolling O up O and O down O on O the O touchpad O , O which O made O the O Creative O Zen O Touch O a O more O attractive O product O for O me O . O",ipod.txt,,[]
360,"Be O sure O you O test O this O first O to O see O if O it O does O feel O intuitive O for O you O , O rather O than O just O going O on O the O fact O that O it O does O sound O pretty O neat O . O",ipod.txt,,[]
361,"BATTERY B-aspect : O Compared O to O the O other O players O on O the O market O , O the O iPod O has O one O of O the O worst O batteries O around O . O",ipod.txt,BATTERY[-3],['BATTERY']
362,"The O Sony O Walkman O and O Creative O Zen O Touch O get O 30 O and O 24 O hours O per O charge O , O respe O",ipod.txt,,[]
363,"Since O no O company O has O yet O to O come O out O with O an O interchangeable O battery O for O the O jukebox-sized O players O the O Creative O Labs O Zen O Micro O is O the O only O one O I O 'm O aware O of O that O has O this O , O and O it O 's O 5 O GB O , O this O can O be O an O issue O . O",ipod.txt,,[]
364,"IN O SUMMARY O : O This O is O a O good O , O basic O player O . O It O 's O not O for O everyone O , O and O if O you O 're O in O the O market O for O one O I O suggest O that O you O try O to O put O aside O the O huge O popularity O of O the O iPod O and O look O harshly O at O the O actual O features O that O the O other O players O on O the O market O have O , O and O see O how O they O stack O up O . O",ipod.txt,,[]
365,"Apple O is O already O being O outpaced O by O Creative O Labs O and O Sony O on O the O battery O front O , O and O just O about O any O non-Apple O player O allows O you O more O compatibility O with O download O services O than O Apple O 's O iTunes-only O program O . O",ipod.txt,,[]
366,"But O since O a O lot O of O these O MP3 O players O are O marketed O on O aesthetics O , O do O go O to O your O local O store O or O borrow O a O friend O 's O and O see O how O the O product O actually O feels O and O works O . O",ipod.txt,,[]
367,"This O may O be O the O player O for O you O , O but O it O 's O not O leaps O and O bounds O ahead O of O any O other O player O , O and O others O are O ahead O of O it O in O certain O areas O , O so O practice O some O caution O when O you O buy O . O",ipod.txt,,[]
368,"Pure O And O Simple O , O Wonderful O Stuff O . O",ipod.txt,,[]
369,"If O , O like O me O you O simply O want O an O iPod B-aspect to O play O your O mp3 O 's O , O buy O this O one O . O",ipod.txt,iPod[+2],['iPod']
370,"If O you O want O colour O screens O , O photos O , O videos O etc O , O buy O the O latest O extremely O expensive O model O , O I O think O the O new O 60GB O has O all O the O extras O . O",ipod.txt,,[]
371,"This O 20GB O just O plays O the O songs O , O most O people O wo O n't O even O use O the O 20GB O space O , O I O 've O got O about O 1500 O songs O on O mine O that O adds O up O to O nearly O 13GB O . O",ipod.txt,,[]
372,I O would O strongly O recommend O the O iPod O over O rival O mp3 O players O such O as O the O Creative O Zen O and O the O creatively O named O iRiver O . O,ipod.txt,,[]
373,"Most O importantly O because O the O iPods O warranty O is O far O superior O to O both O these O , O the O Creative O Zens O is O only O 90 O days O , O way O too O short O . O",ipod.txt,,[]
374,"The O iRivers O is O also O short O , O and O lets O face O it O , O what O is O more O likely O to O brake O or O go O wrong O , O the O Apple O iPod O or O Creative O Zen O , O iRiver O . O",ipod.txt,,[]
375,"Both O from O unspecialist O makes O , O and O in O Creatives O case O a O company O that O deals O mostly O in O computer O parts O , O and O has O not O invested O the O money O that O Apple O has O . O",ipod.txt,,[]
376,So O reliability B-aspect is O the O winner O here O for O the O iPod O . O,ipod.txt,reliability[+2],['reliability']
377,"As O far O as O an O actual O player O is O concerned O , O the O iPod O is O next O to O none O . O",ipod.txt,,[]
378,"The O one O advantage O the O iRiver O has O is O it O can O play O wma O files O aswell O as O mp3s O , O unlike O the O iPod O . O",ipod.txt,,[]
379,"But O all O you O need O to O do O is O convert O the O files O besides O mp3s O are O larger O and O better O quality O files O than O wmas O using O a O wide O range O of O convertors O , O my O favourite O is O the O dBPowerAmp O Music O Coverter O which O also O allows O you O to O burn O directly O from O cd O to O hardrive O in O mp3 O format O unlike O Media O Player O . O",ipod.txt,,[]
380,"It O 's O well O worth O it O , O the O mp3s O do O in O fact O sound O better O . O",ipod.txt,,[]
381,"For O looks B-aspect , O well O iPod O is O head O and O shoulders O better O , O both O the O iRiver O and O Creative O Zen O look O positively O ugly O when O next O to O a O gleaming O iPod O . O",ipod.txt,looks[+2],['looks']
382,"The O iPod O package B-aspect comes O with O everything O you O need O , O the O AC O adaptor O , O firewire O cable O quicker O than O USB O , O but O slower O than O USB O 2 O which O it O also O gives O , O those O snazzy O and O powerfull O headphones O , O and O of O course O the O player O . O",ipod.txt,package[+2],['package']
383,"Quite O simply O , O BUY O THE O IPOD O , O whatever O size O you O wish O . O",ipod.txt,,[]
384,"I O would O go O along O the O lines O of O any O more O than O 2 O thousands O songs O , O get O a O larger O size O such O as O the O 40GB O , O just O to O be O on O the O safe O side O . O",ipod.txt,,[]
385,Just O do O n't O drop O it O . O,ipod.txt,,[]
386,I O had O the O 15G O iPod O of O the O previous O incarnation O . O,ipod.txt,,[]
387,"Actually O I O had O two O : O the O first O one O stopped O working O within O a O month O so O I O took O it O back O , O and O they O exchanged O it O which O is O evidently O pretty O extraordinary O - O guess O I O lucked O out O . O I O did O n't O tell O them O I O had O dropped O it O once O . O",ipod.txt,,[]
388,"Then O I O had O the O second O one O in O my O boyfriend O 's O car O , O and O his O car O got O jacked O . O",ipod.txt,,[]
389,"Fortunately O his O insurance O covered O it O also O extraordinary O , O and O as O luck O would O have O it O , O this O new O gen O of O iPods O came O out O the O same O week O he O got O the O check O . O",ipod.txt,,[]
390,So O I O got O a O free O 5G O upgrade O out O of O that O misfortune O . O,ipod.txt,,[]
391,I O also O got O to O see O just O how O utterly O addicted O I O am O to O my O iPod O in O the O few O weeks O I O had O to O go O without O one O . O,ipod.txt,,[]
392,"The O major O change O from O the O previous O model O , O other O than O the O extra O 5G O for O the O same O price O , O is O that O this O one O is O slightly O smaller O and O lighter O , O and O the O already O minimal O buttons O menu O , O play/pause O , O forward O and O back O have O now O been O assigned O to O the O four O quarters O of O the O click O wheel O , O so O that O even O less O brain O power O is O required O to O search O through O your O 10,000 O stolen O mp3s O . O",ipod.txt,,[]
393,Mac O is O really O big O on O streamlining O everything O maybe O that O 's O why O you O never O get O a O decent O manual O with O any O of O their O products O . O,ipod.txt,,[]
394,"I O like O the O click O wheel O OK O , O but O actually O the O one O problem O I O 've O had O with O this O , O my O third O , O iPod O is O that O occassionally O the O wheel O gets O `` O stuck O , O '' O meaning O either O it O wo O n't O respond O at O all O , O or O it O `` O jumps O '' O down O playlists O uncontrollably O . O",ipod.txt,,[]
395,When O this O happens O I O have O to O toggle O the O lock O switch O on O and O off O to O get O it O to O work O properly O . O,ipod.txt,,[]
396,"I O guess O that O 's O a O pretty O minor O deal O , O but O it O can O be O annoying O . O",ipod.txt,,[]
397,"Needless O to O say O , O these O are O fragile O machines O . O",ipod.txt,,[]
398,"Maybe O this O new O design B-aspect is O more O durable O than O the O last O , O but O I O kind O of O doubt O it O . O",ipod.txt,design[-2],['design']
399,I O do O n't O really O intend O to O drop O mine O to O find O out O . O,ipod.txt,,[]
400,"The O thing O is O , O naturally O you O 're O going O to O use O your O iPod O at O the O gym O or O whatever O , O and O it O can O be O a O bit O of O a O liability O because O you O always O feel O like O you O have O to O protect O it O . O",ipod.txt,,[]
401,Not O that O anybody O would O revert O back O to O their O old-skool O walkman O just O because O you O can O knock O it O around O more O . O,ipod.txt,,[]
402,"The O thousands O of O songs O at O your O fingertips O thing O , O you O just O ca O n't O beat O that O with O a O stick O . O",ipod.txt,,[]
403,"But O seriously O though O , O how O bout O we O work O on O the O durability O thing O for O the O next O gen O . O",ipod.txt,,[]
404,"We O can O start O by O losing O the O shiny O miracle-material O cover O that O you O can O literally O scratch B-aspect just O by O looking O at O it O wrong O , O and O thus O eliminate O the O need O for O third-party O `` O iSkin O '' O protective O covers O for O an O extra O thirty O bucks O . O",ipod.txt,scratch[-2],['scratch']
405,The O other O thing O is O the O earbuds O . O,ipod.txt,,[]
406,"First O of O all O , O I O 've O never O been O big O on O earbuds B-aspect - O they O 're O just O not O that O comfortable O . O",ipod.txt,earbuds[-2][p],['earbuds']
407,"These O are O nice O ones O , O and O you O get O great O sound O at O first O , O but O again O , O they O break O if O you O even O think O mean O things O about O them O . O",ipod.txt,,[]
408,With O both O pairs O I O had O ceramic O rattling O in O my O ears O by O month O two O . O,ipod.txt,,[]
409,And O I O 'm O really O not O that O rough O with O things O ! O,ipod.txt,,[]
410,"These O issues O aside O , O the O iPod B-aspect is O kind O of O like O the O cell O phone O in O that O once O you O have O one O , O you O ca O n't O be O without O one O . O",ipod.txt,iPod[+2],['iPod']
411,Mac O has O at O least O cornered O the O mp3 O player O market O across O the O board O . O,ipod.txt,,[]
412,"PC O users O have O a O lot O of O choices O , O but O based O on O what O I O 've O heard O and O read O , O the O iPod O really O is O the O best O all-around O , O athough O being O a O Mac O product O , O it O has O the O usual O streamlined O and O comparatively O less O customizable O software O . O",ipod.txt,,[]
413,"And O if O you O 're O a O Mac O user O like O me O , O they O 've O naturally O made O sure O you O have O no O viable O alternative B-aspect . O",ipod.txt,alternative[-1],['alternative']
414,"Also O , O you O have O to O use O it O with O iTunes B-aspect - O or O they O 'll O sue O , O dammit O ! O But O iTunes B-aspect is O about O as O good O as O anything O . O",ipod.txt,iTunes[+1],['iTunes']
415,Buy O the O 20GB O instead O of O the O Mini O,ipod.txt,,[]
416,A O lot O of O the O reviews O I O 've O read O talk O about O IPODS O in O general O . O,ipod.txt,,[]
417,I O 'm O writing O about O the O 4G O IPOD O 20GB O model O . O,ipod.txt,,[]
418,"I O ordered O the O mini O from O amazon O , O and O while O waiting O for O it O to O arrive O I O wandered O into O the O Apple O store O . O",ipod.txt,,[]
419,I O 'm O glad O I O did O . O,ipod.txt,,[]
